### ISSUE TITLE
Slow / unreliable connectivity with macOS client

### ISSUE THREAD

**Issue by nnathan** [jedisct1/dsvpn#111]
I haven't been using dsvpn much in the last couple of years but but in the past few months that when I do go to use it, it has been pretty unreliable and slow regardless of my location to my vantage point (server).

This is currently from my hotel to my server without dsvpn:

```
m:~ $ ping -c 10 angry.lastninja.net
PING angry.lastninja.net (152.53.240.229): 56 data bytes
64 bytes from 152.53.240.229: icmp_seq=0 ttl=50 time=196.815 ms
64 bytes from 152.53.240.229: icmp_seq=1 ttl=50 time=198.016 ms
64 bytes from 152.53.240.229: icmp_seq=2 ttl=50 time=212.956 ms
64 bytes from 152.53.240.229: icmp_seq=3 ttl=50 time=194.016 ms
64 bytes from 152.53.240.229: icmp_seq=4 ttl=50 time=191.218 ms
64 bytes from 152.53.240.229: icmp_seq=5 ttl=50 time=211.418 ms
64 bytes from 152.53.240.229: icmp_seq=6 ttl=50 time=203.754 ms
64 bytes from 152.53.240.229: icmp_seq=7 ttl=50 time=196.907 ms
64 bytes from 152.53.240.229: icmp_seq=8 ttl=50 time=199.512 ms
64 bytes from 152.53.240.229: icmp_seq=9 ttl=50 time=200.986 ms

--- angry.lastninja.net ping statistics ---
10 packets transmitted, 10 packets received, 0.0% packet loss
round-trip min/avg/max/stddev = 191.218/200.560/212.956/6.686 ms
```

From `angry.lastninja.net` to `1.1.1.1`:

```
angry:~ $ ping -c 10 1.1.1.1
PING 1.1.1.1 (1.1.1.1) 56(84) bytes of data.
64 bytes from 1.1.1.1: icmp_seq=1 ttl=58 time=1.93 ms
64 bytes from 1.1.1.1: icmp_seq=2 ttl=58 time=1.84 ms
64 bytes from 1.1.1.1: icmp_seq=3 ttl=58 time=1.93 ms
64 bytes from 1.1.1.1: icmp_seq=4 ttl=58 time=1.94 ms
64 bytes from 1.1.1.1: icmp_seq=5 ttl=58 time=1.92 ms
64 bytes from 1.1.1.1: icmp_seq=6 ttl=58 time=1.82 ms
64 bytes from 1.1.1.1: icmp_seq=7 ttl=58 time=1.87 ms
64 bytes from 1.1.1.1: icmp_seq=8 ttl=58 time=1.87 ms
64 bytes from 1.1.1.1: icmp_seq=9 ttl=58 time=1.87 ms
64 bytes from 1.1.1.1: icmp_seq=10 ttl=58 time=1.90 ms

--- 1.1.1.1 ping statistics ---
10 packets transmitted, 10 received, 0% packet loss, time 9012ms
rtt min/avg/max/mdev = 1.815/1.887/1.940/0.039 ms
```

Now when I try to use the dsvpn client from my hotel, this is what I am contending with:

```
m:~ $ ping -c 10 1.1.1.1
PING 1.1.1.1 (1.1.1.1): 56 data bytes
64 bytes from 1.1.1.1: icmp_seq=0 ttl=57 time=552.386 ms
64 bytes from 1.1.1.1: icmp_seq=1 ttl=57 time=371.872 ms
64 bytes from 1.1.1.1: icmp_seq=2 ttl=57 time=385.418 ms
64 bytes from 1.1.1.1: icmp_seq=3 ttl=57 time=479.062 ms
64 bytes from 1.1.1.1: icmp_seq=4 ttl=57 time=982.022 ms
64 bytes from 1.1.1.1: icmp_seq=5 ttl=57 time=376.685 ms
Request timeout for icmp_seq 6
Request timeout for icmp_seq 7
64 bytes from 1.1.1.1: icmp_seq=6 ttl=57 time=2150.549 ms
64 bytes from 1.1.1.1: icmp_seq=7 ttl=57 time=1390.549 ms
64 bytes from 1.1.1.1: icmp_seq=8 ttl=57 time=742.387 ms
64 bytes from 1.1.1.1: icmp_seq=9 ttl=57 time=296.318 ms

--- 1.1.1.1 ping statistics ---
10 packets transmitted, 10 packets received, 0.0% packet loss
round-trip min/avg/max/stddev = 296.318/772.725/2150.549/561.615 ms

m:~ $ ping -c 10 angry.lastninja.net
PING angry.lastninja.net (152.53.240.229): 56 data bytes
64 bytes from 152.53.240.229: icmp_seq=0 ttl=50 time=192.224 ms
64 bytes from 152.53.240.229: icmp_seq=1 ttl=50 time=191.164 ms
64 bytes from 152.53.240.229: icmp_seq=2 ttl=50 time=192.316 ms
64 bytes from 152.53.240.229: icmp_seq=3 ttl=50 time=191.309 ms
64 bytes from 152.53.240.229: icmp_seq=4 ttl=50 time=194.101 ms
64 bytes from 152.53.240.229: icmp_seq=5 ttl=50 time=191.567 ms
64 bytes from 152.53.240.229: icmp_seq=6 ttl=50 time=208.852 ms
64 bytes from 152.53.240.229: icmp_seq=7 ttl=50 time=219.499 ms
64 bytes from 152.53.240.229: icmp_seq=8 ttl=50 time=214.687 ms
64 bytes from 152.53.240.229: icmp_seq=9 ttl=50 time=204.168 ms

--- angry.lastninja.net ping statistics ---
10 packets transmitted, 10 packets received, 0.0% packet loss
round-trip min/avg/max/stddev = 191.164/199.989/219.499/10.347 ms
```

The ping to 1.1.1.1 is quite abnormal as it really should be just the RTT to angry.lastninja.net (~210ms) + roughly 2ms.

This is the extent of my troubleshoot so far, was hoping you might have some insight as to what might be going on.

Using the latest version of dsvpn from github on Arch Linux on angry.
```
angry:dsvpn $ sudo ./dsvpn server vpn.key auto 5000
```

Using the latest version of dsvpn from homebrew on hostname m.
```
m:~ $ sudo dsvpn client vpn.key angry.lastninja.net 5000
```

```
m:~ $ sw_vers
ProductName:            macOS
ProductVersion:         26.4.1
BuildVersion:           25E253
```

**Comment by nnathan** [comment]
I spun up a VM on my mac (m) to do some testing with Arch Linux.

Before connecting via dsvpn:

```
[root@v dsvpn]# ping -c 100 -f angry.lastninja.net
PING angry.lastninja.net (152.53.240.229) 56(84) bytes of data.

--- angry.lastninja.net ping statistics ---
100 packets transmitted, 100 received, 0% packet loss, time 1317ms
rtt min/avg/max/mdev = 190.769/200.272/275.641/18.239 ms, pipe 22, ipg/ewma 13.300/191.991 ms
```

After connecting to dsvpn:

```
[root@v dsvpn]# ping -c 100 -f angry.lastninja.net
PING angry.lastninja.net (152.53.240.229) 56(84) bytes of data.

--- angry.lastninja.net ping statistics ---
100 packets transmitted, 100 received, 0% packet loss, time 1195ms
rtt min/avg/max/mdev = 204.530/298.315/417.764/51.116 ms, pipe 34, ipg/ewma 12.071/285.494 ms
```

Odd that there's a delta of about 90ms on average once connected via dsvpn, since it is pinging the vpn termination endpoint.

```
[root@v dsvpn]# ping -c 100 -f 1.1.1.1
PING 1.1.1.1 (1.1.1.1) 56(84) bytes of data.
.
--- 1.1.1.1 ping statistics ---
100 packets transmitted, 99 received, 1% packet loss, time 1194ms
rtt min/avg/max/mdev = 198.087/314.223/617.809/65.315 ms, pipe 35, ipg/ewma 12.061/368.151 ms
```

Again that's a huge delta for pinging 1.1.1.1.

The issue is a lot less pronounced on the Linux side of things run on a VM on a mac -- ~that is there's a significant latency delta (but much less compared to the mac host)~ (see edit below), but it doesn't feel slow or unreliable that I see when connecting on the host (mac) itself.

Edit: Things look pretty normal when you don't flood ping. So maybe that artificial latency could be dsvpn when handling a large flood of packets.

```
[root@v dsvpn]# ping -c 10 angry.lastninja.net
PING angry.lastninja.net (152.53.240.229) 56(84) bytes of data.
64 bytes from v2202512327516422119.quicksrv.de (152.53.240.229): icmp_seq=1 ttl=64 time=199 ms
64 bytes from v2202512327516422119.quicksrv.de (152.53.240.229): icmp_seq=2 ttl=64 time=204 ms
64 bytes from v2202512327516422119.quicksrv.de (152.53.240.229): icmp_seq=3 ttl=64 time=198 ms
64 bytes from v2202512327516422119.quicksrv.de (152.53.240.229): icmp_seq=4 ttl=64 time=201 ms
64 bytes from v2202512327516422119.quicksrv.de (152.53.240.229): icmp_seq=5 ttl=64 time=196 ms
64 bytes from v2202512327516422119.quicksrv.de (152.53.240.229): icmp_seq=6 ttl=64 time=196 ms
64 bytes from v2202512327516422119.quicksrv.de (152.53.240.229): icmp_seq=7 ttl=64 time=197 ms
64 bytes from v2202512327516422119.quicksrv.de (152.53.240.229): icmp_seq=8 ttl=64 time=207 ms
64 bytes from v2202512327516422119.quicksrv.de (152.53.240.229): icmp_seq=9 ttl=64 time=205 ms
64 bytes from v2202512327516422119.quicksrv.de (152.53.240.229): icmp_seq=10 ttl=64 time=197 ms

--- angry.lastninja.net ping statistics ---
10 packets transmitted, 10 received, 0% packet loss, time 9023ms
rtt min/avg/max/mdev = 195.778/200.060/207.493/3.880 ms
[root@v dsvpn]# ping -c 10 1.1.1.1
PING 1.1.1.1 (1.1.1.1) 56(84) bytes of data.
64 bytes from 1.1.1.1: icmp_seq=1 ttl=57 time=197 ms
64 bytes from 1.1.1.1: icmp_seq=2 ttl=57 time=198 ms
64 bytes from 1.1.1.1: icmp_seq=3 ttl=57 time=198 ms
64 bytes from 1.1.1.1: icmp_seq=4 ttl=57 time=207 ms
64 bytes from 1.1.1.1: icmp_seq=5 ttl=57 time=199 ms
64 bytes from 1.1.1.1: icmp_seq=6 ttl=57 time=199 ms
64 bytes from 1.1.1.1: icmp_seq=7 ttl=57 time=203 ms
64 bytes from 1.1.1.1: icmp_seq=8 ttl=57 time=198 ms
64 bytes from 1.1.1.1: icmp_seq=9 ttl=57 time=198 ms
64 bytes from 1.1.1.1: icmp_seq=10 ttl=57 time=198 ms

--- 1.1.1.1 ping statistics ---
10 packets transmitted, 10 received, 0% packet loss, time 9025ms
rtt min/avg/max/mdev = 196.658/199.371/207.496/3.136 ms
```

**Comment by jedisct1** [comment]
The direct ping to the server can stay clean while the tunnel is bad: packets inside the tunnel are queued in the single TCP connection used by DSVPN, so any loss/throttling/bufferbloat on that TCP stream can show up as large latency spikes for ICMP through the tunnel.

A few things worth checking:

* Try port `443` instead of `5000`. Some hotel/public networks treat non-standard TCP ports very differently, even when ping to the same host looks fine.
* On the Linux server, check what congestion control the DSVPN socket actually gets: `sysctl net.ipv4.tcp_congestion_control net.ipv4.tcp_available_congestion_control net.core.default_qdisc`. BBR + fq generally behaves much better here.
* While connected on macOS, verify that the route to `angry.lastninja.net` still goes outside the tunnel: `route -n get angry.lastninja.net` and `netstat -rn -f inet`. DSVPN adds a host route for the server before the default split routes, but this is worth confirming.
* Please try building/running the client from current git on macOS too, not only the Homebrew binary, so we can rule out an outdated formula/build difference.
* If possible, compare with a plain TCP test to the server on the same port/network, e.g. `iperf3` or even an SSH/scp transfer, to see whether the TCP connection itself is getting queued/retransmitted.

The Linux VM result being much better than the macOS host is interesting. If the same network/server/port behaves badly only on native macOS, this may be macOS TCP/utun behavior or routing rather than the server side.

**Comment by nnathan** [comment]
I've switched to using the git version of dspvn on the mac.

 - Tried port 443, exhibits the same issue as 5000. Both work fine in Linux VM.

- sysctl on angry:

```
angry:~ $ sysctl net.ipv4.tcp_congestion_control net.ipv4.tcp_available_congestion_control net.core.default_qdisc
net.ipv4.tcp_congestion_control = cubic
net.ipv4.tcp_available_congestion_control = reno cubic bbr
net.core.default_qdisc = fq_codel
```

- Verified that route get goes direct to the wireless router and route get has a direct host route when dsvpn is connected. Host connectivity appears normal baseline when connected via dsvpn to angry.

- I used scp instead of iperf3 as it was a bit quicker. Without dsvpn I get 2.6-3.7MB/s which is sufficient. I get the same with dsvpn connected.

Everything seems fine on Linux VM.

Although I am on my travel macbook air, I've seen the same issues at my house on my macbook pro 16", so I don't think it is isolated to the laptop I am using at the moment.

**Comment by nnathan** [comment]
I just had a friend quickly test on his macbook too, it was exhibiting the same symptoms as well. I didn't catch his macOS version though.

**Comment by nnathan** [comment]
Tried BBR:

```
angry:~ $ sysctl net.ipv4.tcp_congestion_control net.ipv4.tcp_available_congestion_control net.core.default_qdisc
net.ipv4.tcp_congestion_control = bbr
net.ipv4.tcp_available_congestion_control = reno cubic bbr
net.core.default_qdisc = fq_codel
```

(Then started dsvpn server again)

I'm getting the following pings:

```
m:dsvpn $ ping 1.1.1.1
PING 1.1.1.1 (1.1.1.1): 56 data bytes
64 bytes from 1.1.1.1: icmp_seq=0 ttl=57 time=298.207 ms
64 bytes from 1.1.1.1: icmp_seq=1 ttl=57 time=574.025 ms
64 bytes from 1.1.1.1: icmp_seq=2 ttl=57 time=506.731 ms
64 bytes from 1.1.1.1: icmp_seq=3 ttl=57 time=228.739 ms
64 bytes from 1.1.1.1: icmp_seq=4 ttl=57 time=712.191 ms
64 bytes from 1.1.1.1: icmp_seq=5 ttl=57 time=337.765 ms
64 bytes from 1.1.1.1: icmp_seq=6 ttl=57 time=811.473 ms
64 bytes from 1.1.1.1: icmp_seq=7 ttl=57 time=474.684 ms
^C
--- 1.1.1.1 ping statistics ---
9 packets transmitted, 8 packets received, 11.1% packet loss
round-trip min/avg/max/stddev = 228.739/492.977/811.473/189.880 ms
```

**Comment by jedisct1** [comment]
Thanks, this is really useful data.

The combination of:

* current git build on macOS behaving the same as Homebrew
* ports `443` and `5000` behaving the same
* Linux VM on the same Mac/network looking fine with normal pings
* plain `scp` throughput staying normal while DSVPN is connected
* BBR on the server not changing the symptom
* another MacBook showing the same behavior

pretty much rules out the hotel network, the server TCP congestion control, and an outdated formula as the main cause.

This is starting to look like something specific to the native macOS path, probably either `utun` behavior or a macOS TCP/utun interaction. One suspicious area is that the macOS `tun_write()` path uses a synchronous `writev()` to the utun device. If that ever blocks or backpressures, the single event loop can temporarily stop reading/writing the TCP socket, which would show up exactly as bursty latency inside the tunnel while the direct route to the server stays clean.

A couple more small tests would help narrow that down if you have time:

* If you can get your friend's macOS version, that would be useful. Same for any test on an older macOS release if one is available.
* After DSVPN starts, try lowering the utun MTU and then repeat the `ping 1.1.1.1` test:

  ```sh
  ifconfig | grep -A4 '^utun'
  sudo ifconfig utunX mtu 1280
  # or even 1200 if 1280 doesn't change anything
  ```

* During a bad ping run, check whether the outer TCP connection is actually retransmitting, or whether this is local queueing. A simple before/after is enough:

  ```sh
  netstat -s -p tcp
  ping -c 20 1.1.1.1
  netstat -s -p tcp
  ```

  If retransmits don't move much while latency spikes, that would point even more strongly at the local macOS/utun side.

I'll try to reproduce this on macOS and look at making the utun side non-blocking / better isolated from the TCP side. The Linux VM comparison was especially helpful, thanks!

**Comment by nnathan** [comment]
- Just waiting for friend to respond and I will update his macos version in a new comment. Also should be having another friend test soon as well he has a vintage intel mac so it'll come with an older version of macOS, possibly OSX which could identify any discrepency between versions.

- with mtu 1280

```
m:~ $ ifconfig utun6
utun6: flags=8051<UP,POINTOPOINT,RUNNING,MULTICAST> mtu 1280
        inet 192.168.192.1 --> 192.168.192.254 netmask 0xffffff00
        inet6 fe80::fcbf:bed4:7710:6459%utun6 prefixlen 64 scopeid 0x15
        inet6 64:ff9b::c0a8:c001 --> 64:ff9b::c0a8:c0fe prefixlen 128
        nd6 options=201<PERFORMNUD,DAD>
m:~ $ ping 1.1.1.1
PING 1.1.1.1 (1.1.1.1): 56 data bytes
64 bytes from 1.1.1.1: icmp_seq=0 ttl=57 time=717.629 ms
64 bytes from 1.1.1.1: icmp_seq=1 ttl=57 time=635.001 ms
64 bytes from 1.1.1.1: icmp_seq=2 ttl=57 time=442.260 ms
64 bytes from 1.1.1.1: icmp_seq=3 ttl=57 time=349.370 ms
64 bytes from 1.1.1.1: icmp_seq=4 ttl=57 time=231.616 ms
^C
--- 1.1.1.1 ping statistics ---
5 packets transmitted, 5 packets received, 0.0% packet loss
round-trip min/avg/max/stddev = 231.616/475.175/717.629/179.198 ms
```

- no tcp retransmissions

```
m:~ $ netstat -s -p tcp | egrep -v '^\s*0'
tcp:
        39 open TCP sockets
m:~ $ ping 1.1.1.1
PING 1.1.1.1 (1.1.1.1): 56 data bytes
64 bytes from 1.1.1.1: icmp_seq=0 ttl=57 time=244.120 ms
64 bytes from 1.1.1.1: icmp_seq=1 ttl=57 time=270.321 ms
64 bytes from 1.1.1.1: icmp_seq=2 ttl=57 time=282.039 ms
64 bytes from 1.1.1.1: icmp_seq=3 ttl=57 time=277.583 ms
64 bytes from 1.1.1.1: icmp_seq=4 ttl=57 time=321.433 ms
64 bytes from 1.1.1.1: icmp_seq=5 ttl=57 time=270.082 ms
64 bytes from 1.1.1.1: icmp_seq=6 ttl=57 time=425.621 ms
64 bytes from 1.1.1.1: icmp_seq=7 ttl=57 time=795.503 ms
64 bytes from 1.1.1.1: icmp_seq=8 ttl=57 time=303.053 ms
64 bytes from 1.1.1.1: icmp_seq=9 ttl=57 time=505.246 ms
64 bytes from 1.1.1.1: icmp_seq=10 ttl=57 time=213.473 ms
^C
--- 1.1.1.1 ping statistics ---
12 packets transmitted, 11 packets received, 8.3% packet loss
round-trip min/avg/max/stddev = 213.473/355.316/795.503/160.525 ms
m:~ $ netstat -s -p tcp | egrep -v '^\s*0'
tcp:
        41 open TCP sockets
```

**Comment by jedisct1** [comment]
Thanks! The MTU test not changing things and the TCP counters staying flat are both pretty strong signals.

So this probably isn't fragmentation, and it doesn't look like the outer TCP connection is losing/retransmitting packets. That narrows it down to local queueing/stalling on one of the native macOS sides of the event loop: reading from `utun`, writing to `utun`, or the process getting stuck long enough that the TCP socket isn't serviced promptly.

One useful next split would be to test the tunnel endpoint itself, not just traffic forwarded through the server:

```sh
ping -c 20 192.168.192.254
```

from the macOS client while connected. If that shows the same spikes, the forwarding/NAT path to `1.1.1.1` is out of the picture and the issue is entirely inside the client<->server tunnel path.

If you can also run the inverse from the server:

```sh
ping -c 20 192.168.192.1
```

that may help show whether one direction is worse than the other.

I'm going to look at a small macOS-specific test change next: make the utun fd non-blocking and avoid letting a blocked utun write stall the TCP side of the loop. If this is local backpressure, that should at least change the failure mode, and hopefully improve it.

**Comment by nnathan** [comment]
The tunnel endpoints from both sides don't seem to allow ICMP.

My friend's macOS version that tested earlier:

```
n@ns-MacBook-Air ~/snap/dsvpn $  sw_vers
ProductName:            macOS
ProductVersion:         26.4.1
BuildVersion:           25E253
```

**Comment by jedisct1** [comment]
No worries about the endpoint ICMP test; that's not a blocker.

The friend's version is useful though: so far the native macOS reports are all on `26.4.1 / 25E253`, while the Linux VM on the same hardware/network behaves normally. That makes me less inclined to chase routing/NAT/server-side behavior and more inclined to look at a macOS-version-specific `utun`/socket interaction.

If the Intel Mac / older macOS test happens, that result would be especially interesting. If it works there, we probably have a recent macOS regression or changed `utun` behavior. If it fails there too, then it's more likely a long-standing bug in DSVPN's macOS event loop that only became visible with your current testing.

I'll focus next on a small test patch for macOS to make the `utun` side non-blocking / less able to stall the TCP side. Thanks again for doing all these checks.

**Comment by nnathan** [comment]
My other friend with vintage intel mac:

```
% sw_vers 
ProductName:        macOS
ProductVersion:        15.7.5
BuildVersion:        24G624
```

Baseline:

```
% ping -c 10 angry.lastninja.net
PING angry.lastninja.net (152.53.240.229): 56 data bytes
64 bytes from 152.53.240.229: icmp_seq=0 ttl=52 time=81.979 ms
64 bytes from 152.53.240.229: icmp_seq=1 ttl=52 time=90.636 ms
64 bytes from 152.53.240.229: icmp_seq=2 ttl=52 time=78.496 ms
64 bytes from 152.53.240.229: icmp_seq=3 ttl=52 time=88.752 ms
64 bytes from 152.53.240.229: icmp_seq=4 ttl=52 time=81.737 ms
64 bytes from 152.53.240.229: icmp_seq=5 ttl=52 time=83.821 ms
64 bytes from 152.53.240.229: icmp_seq=6 ttl=52 time=81.974 ms
64 bytes from 152.53.240.229: icmp_seq=7 ttl=52 time=79.629 ms
64 bytes from 152.53.240.229: icmp_seq=8 ttl=52 time=92.545 ms
64 bytes from 152.53.240.229: icmp_seq=9 ttl=52 time=90.183 ms

--- angry.lastninja.net ping statistics ---
10 packets transmitted, 10 packets received, 0.0% packet loss
round-trip min/avg/max/stddev = 78.496/84.975/92.545/4.807 ms
```

Connected to angry:

```
% ping -c 10 1.1.1.1
PING 1.1.1.1 (1.1.1.1): 56 data bytes
64 bytes from 1.1.1.1: icmp_seq=0 ttl=57 time=89.511 ms
64 bytes from 1.1.1.1: icmp_seq=1 ttl=57 time=84.513 ms
64 bytes from 1.1.1.1: icmp_seq=2 ttl=57 time=83.503 ms
64 bytes from 1.1.1.1: icmp_seq=3 ttl=57 time=82.781 ms
64 bytes from 1.1.1.1: icmp_seq=4 ttl=57 time=86.662 ms
64 bytes from 1.1.1.1: icmp_seq=5 ttl=57 time=84.557 ms
64 bytes from 1.1.1.1: icmp_seq=6 ttl=57 time=85.594 ms
64 bytes from 1.1.1.1: icmp_seq=7 ttl=57 time=86.308 ms
64 bytes from 1.1.1.1: icmp_seq=8 ttl=57 time=82.419 ms
64 bytes from 1.1.1.1: icmp_seq=9 ttl=57 time=85.534 ms

--- 1.1.1.1 ping statistics ---
10 packets transmitted, 10 packets received, 0.0% packet loss
round-trip min/avg/max/stddev = 82.419/85.138/89.511/1.988 ms
```

Doesn't exhibit issue.

**Comment by jedisct1** [comment]
That's a very useful data point. So macOS `15.7.5 / 24G624` on the Intel Mac does *not* show the issue, while the machines on `26.4.1 / 25E253` do. That makes this look much more like a recent macOS behavior change/regression than a generic DSVPN-on-macOS problem.

Could you try this small diagnostic patch on one of the affected `26.4.1` machines? It makes the macOS `utun` fd non-blocking and logs if writes back to `utun` would block. The patch applies cleanly on current git for me.

```diff
--- a/src/os.c
+++ b/src/os.c
@@ -277,6 +277,10 @@
         },
     };
     ret = writev(fd, iov, 2);
+    if (ret < (ssize_t) 0 && (errno == EAGAIN || errno == EWOULDBLOCK)) {
+        errno = EAGAIN;
+        return 0;
+    }
     if (ret <= (ssize_t) 0) {
         return ret;
     }
--- a/src/vpn.c
+++ b/src/vpn.c
@@ -358,6 +358,7 @@
     ssize_t              len;
     int                  found_fds;
     int                  new_client_fd;
+    static unsigned int  tun_eagain_count;
 
     if (exit_signal_received != 0) {
         return -2;
@@ -387,6 +388,9 @@
     }
     if (fds[POLLFD_TUN].revents & POLLIN) {
         len = tun_read(context->tun_fd, tun_buf.data, sizeof tun_buf.data);
+        if (len < (ssize_t) 0 && (errno == EAGAIN || errno == EWOULDBLOCK)) {
+            return 0;
+        }
         if (len <= 0) {
             perror("tun_read");
             return -1;
@@ -428,6 +432,7 @@
         uint16_t binlen;
         size_t   len_with_header;
         ssize_t  readnb;
+        ssize_t  tun_writenb;
 
         if ((readnb = safe_read_partial(context->client_fd, client_buf->len + client_buf->pos,
                                         2 + TAG_LEN + MAX_PACKET_LEN - client_buf->pos)) <= 0) {
@@ -448,7 +453,13 @@
                 sleep(1);
                 return client_reconnect(context);
             }
-            if (tun_write(context->tun_fd, client_buf->data, (size_t) len) != len) {
+            tun_writenb = tun_write(context->tun_fd, client_buf->data, (size_t) len);
+            if (tun_writenb == 0 && errno == EAGAIN) {
+                tun_eagain_count++;
+                if ((tun_eagain_count & 255U) == 1U) {
+                    fprintf(stderr, "utun write would block (%u)\n", tun_eagain_count);
+                }
+            } else if (tun_writenb != len) {
                 perror("tun_write");
             }
             if (2 + TAG_LEN + MAX_PACKET_LEN != len_with_header) {
@@ -603,6 +614,9 @@
         return 1;
     }
     printf("Interface: [%s]\n", context.if_name);
+#ifdef __APPLE__
+    (void) fcntl(context.tun_fd, F_SETFL, fcntl(context.tun_fd, F_GETFL, 0) | O_NONBLOCK);
+#endif
     if (tun_set_mtu(context.if_name, DEFAULT_MTU) != 0) {
         perror("mtu");
     }
```

Then rebuild/run the macOS client from that tree:

```sh
make clean
make
sudo ./dsvpn client vpn.key angry.lastninja.net 443
```

The interesting result is whether `utun write would block (...)` appears while the ping latency spikes. If it does, we have a very direct signal that the new macOS `utun` path is applying backpressure and the current single-loop design handles that poorly. If the latency still spikes but no messages appear, I'll look at the opposite direction next: `utun` reads or TCP writes.

**Comment by nnathan** [comment]
Still exhibiting the issue:

```
m:dsvpn $ ping -c 10 angry.lastninja.net
PING angry.lastninja.net (152.53.240.229): 56 data bytes
64 bytes from 152.53.240.229: icmp_seq=0 ttl=50 time=192.055 ms
64 bytes from 152.53.240.229: icmp_seq=1 ttl=50 time=201.132 ms
64 bytes from 152.53.240.229: icmp_seq=2 ttl=50 time=191.440 ms
64 bytes from 152.53.240.229: icmp_seq=3 ttl=50 time=191.616 ms
64 bytes from 152.53.240.229: icmp_seq=4 ttl=50 time=191.185 ms
64 bytes from 152.53.240.229: icmp_seq=5 ttl=50 time=191.899 ms
64 bytes from 152.53.240.229: icmp_seq=6 ttl=50 time=207.879 ms
64 bytes from 152.53.240.229: icmp_seq=7 ttl=50 time=191.987 ms
64 bytes from 152.53.240.229: icmp_seq=8 ttl=50 time=191.814 ms
64 bytes from 152.53.240.229: icmp_seq=9 ttl=50 time=191.800 ms

--- angry.lastninja.net ping statistics ---
10 packets transmitted, 10 packets received, 0.0% packet loss
round-trip min/avg/max/stddev = 191.185/194.281/207.879/5.336 ms
m:dsvpn $ ping -c 10 1.1.1.1
PING 1.1.1.1 (1.1.1.1): 56 data bytes
64 bytes from 1.1.1.1: icmp_seq=0 ttl=57 time=507.827 ms
64 bytes from 1.1.1.1: icmp_seq=1 ttl=57 time=347.397 ms
64 bytes from 1.1.1.1: icmp_seq=2 ttl=57 time=675.382 ms
64 bytes from 1.1.1.1: icmp_seq=3 ttl=57 time=415.643 ms
64 bytes from 1.1.1.1: icmp_seq=4 ttl=57 time=239.096 ms
64 bytes from 1.1.1.1: icmp_seq=5 ttl=57 time=344.753 ms
64 bytes from 1.1.1.1: icmp_seq=6 ttl=57 time=205.273 ms
64 bytes from 1.1.1.1: icmp_seq=7 ttl=57 time=212.278 ms
64 bytes from 1.1.1.1: icmp_seq=8 ttl=57 time=328.411 ms
64 bytes from 1.1.1.1: icmp_seq=9 ttl=57 time=378.873 ms

--- 1.1.1.1 ping statistics ---
10 packets transmitted, 10 packets received, 0.0% packet loss
round-trip min/avg/max/stddev = 205.273/365.493/675.382/136.469 ms
```

This was the ongoing status:

```
m:dsvpn $ sudo ./dsvpn client vpn.key angry.lastninja.net 5000
Interface: [utun6]
Trying to reconnect
Connecting to 152.53.240.229:5000...
add host 152.53.240.229: gateway 192.168.1.251
add net 0: gateway 192.168.192.254
add net 128: gateway 192.168.192.254
add net 0000::/1: gateway 64:ff9b::192.168.192.254
add net 8000::/1: gateway 64:ff9b::192.168.192.254
Connected
```

**Comment by jedisct1** [comment]
Thanks for testing that so quickly. The absence of `utun write would block` while the symptom is still there is actually helpful: it makes the server-to-client `utun` write path less likely to be the culprit.

The Intel/older macOS result still points pretty strongly at something that changed in newer macOS, so I'd like to check the other half of the client event loop: packets going from macOS `utun` into the outer TCP socket. Could you try this tiny additional patch on top of the previous one? It only adds logging around the TCP write path, so if the TCP socket is locally backpressuring without retransmits, we should see it.

```diff
--- a/src/vpn.c
+++ b/src/vpn.c
@@ -358,6 +358,8 @@
     ssize_t              len;
     int                  found_fds;
     int                  new_client_fd;
+    static unsigned int  tcp_eagain_count;
+    static unsigned int  tcp_short_write_count;
     static unsigned int  tun_eagain_count;
 
     if (exit_signal_received != 0) {
@@ -411,10 +413,23 @@
             memcpy(tun_buf.tag, tag_full, TAG_LEN);
             writenb = safe_write_partial(context->client_fd, tun_buf.len, 2U + TAG_LEN + len);
             if (writenb < (ssize_t) 0) {
+                if (errno == EAGAIN || errno == EWOULDBLOCK) {
+                    tcp_eagain_count++;
+                    if ((tcp_eagain_count & 255U) == 1U) {
+                        fprintf(stderr, "tcp write would block (%u)\n", tcp_eagain_count);
+                    }
+                }
                 context->congestion = 1;
                 writenb             = (ssize_t) 0;
             }
             if (writenb != (ssize_t) (2U + TAG_LEN + len)) {
+                if (writenb > (ssize_t) 0) {
+                    tcp_short_write_count++;
+                    if ((tcp_short_write_count & 255U) == 1U) {
+                        fprintf(stderr, "tcp short write (%u): %zd/%zu\n",
+                                tcp_short_write_count, writenb, 2U + TAG_LEN + (size_t) len);
+                    }
+                }
                 writenb = safe_write(context->client_fd, tun_buf.len + writenb,
                                      2U + TAG_LEN + len - writenb, TIMEOUT);
             }
```

Same rebuild/run as before. If either `tcp write would block` or `tcp short write` appears during the bad pings, that would explain the added latency without requiring TCP retransmits: the client is queuing locally before bytes even get onto the wire. If no messages appear, the next thing I'd check is whether macOS is delaying delivery from the utun fd to the process rather than blocking writes.

**Comment by nnathan** [comment]
Same issue:

```
m:dsvpn $ ping -c 10 1.1.1.1
PING 1.1.1.1 (1.1.1.1): 56 data bytes
64 bytes from 1.1.1.1: icmp_seq=0 ttl=57 time=547.193 ms
Request timeout for icmp_seq 1
64 bytes from 1.1.1.1: icmp_seq=1 ttl=57 time=1172.628 ms
64 bytes from 1.1.1.1: icmp_seq=2 ttl=57 time=379.668 ms
64 bytes from 1.1.1.1: icmp_seq=3 ttl=57 time=246.811 ms
64 bytes from 1.1.1.1: icmp_seq=4 ttl=57 time=507.668 ms
64 bytes from 1.1.1.1: icmp_seq=5 ttl=57 time=672.198 ms
64 bytes from 1.1.1.1: icmp_seq=6 ttl=57 time=292.390 ms
64 bytes from 1.1.1.1: icmp_seq=7 ttl=57 time=780.269 ms
64 bytes from 1.1.1.1: icmp_seq=8 ttl=57 time=254.620 ms
64 bytes from 1.1.1.1: icmp_seq=9 ttl=57 time=251.338 ms

--- 1.1.1.1 ping statistics ---
10 packets transmitted, 10 packets received, 0.0% packet loss
round-trip min/avg/max/stddev = 246.811/510.478/1172.628/283.822 ms```
```

angry direct ping is ~190-205ms

dsvpn status:

```
m:dsvpn $ sudo ./dsvpn client vpn.key angry.lastninja.net 5000
Interface: [utun6]
Trying to reconnect
Connecting to 152.53.240.229:5000...
add host 152.53.240.229: gateway 192.168.1.251
add net 0: gateway 192.168.192.254
add net 128: gateway 192.168.192.254
add net 0000::/1: gateway 64:ff9b::192.168.192.254
add net 8000::/1: gateway 64:ff9b::192.168.192.254
Connected
```

**Comment by jedisct1** [comment]
Thanks. Since there are still no diagnostic lines from either patch, that tells us something useful too: neither `utun` writes nor TCP writes are obviously returning `EAGAIN`/short writes in userland. So the delay may be happening before packets become readable from `utun`, inside the kernel/network stack, or somewhere after the bytes are accepted by the TCP socket.

At this point, the most useful next check is probably timestamping the packet flow on the affected Mac. Could you run two `tcpdump`s while doing a short ping?

Terminal 1, on the DSVPN interface:

```sh
sudo tcpdump -tttt -n -i utun6 'icmp and host 1.1.1.1'
```

Terminal 2, on the real network interface. You can get it with `route -n get angry.lastninja.net | grep interface`; it is probably `en0`:

```sh
sudo tcpdump -tttt -n -i en0 'host 152.53.240.229 and tcp port 5000'
```

Then in Terminal 3:

```sh
ping -c 5 1.1.1.1
```

If you are testing on port `443`, replace `5000` in the tcpdump filter with `443`.

What I'm looking for is where the gap appears:

* ICMP request appears late on `utun6` -> macOS is delaying delivery into DSVPN.
* ICMP request is prompt on `utun6`, but the outer TCP packets are delayed on `en0` -> DSVPN/userland/TCP send side.
* Outer TCP response returns promptly on `en0`, but ICMP reply appears late on `utun6` -> receive/decrypt/utun output side.

A few timestamps around one bad ping should be enough; no need for a long capture.

**Comment by nnathan** [comment]
I tried to isolate:

```
64 bytes from 1.1.1.1: icmp_seq=8 ttl=57 time=479.734 ms
64 bytes from 1.1.1.1: icmp_seq=9 ttl=57 time=542.965 ms
```

With timestamps:

```
2026-05-01 03:40:00.230526 IP 192.168.192.1 > 1.1.1.1: ICMP echo request, id 64913, seq 8, length 64
2026-05-01 03:40:00.710076 IP 1.1.1.1 > 192.168.192.1: ICMP echo reply, id 64913, seq 8, length 64
2026-05-01 03:40:01.234140 IP 192.168.192.1 > 1.1.1.1: ICMP echo request, id 64913, seq 9, length 64
2026-05-01 03:40:01.776883 IP 1.1.1.1 > 192.168.192.1: ICMP echo reply, id 64913, seq 9, length 64
```

With the following tcpdump output for the outer tcp connection:

```
2026-05-01 03:40:00.000535 IP 192.168.19.207.57771 > 152.53.240.229.5000: Flags [P.], seq 162782:162854, ack 324632, win 2048, options [nop,nop,TS val 2964747316 ecr 3739214797], length 72
2026-05-01 03:40:00.084809 IP 152.53.240.229.5000 > 192.168.19.207.57771: Flags [.], ack 162722, win 2732, options [nop,nop,TS val 3739214934 ecr 2964747164], length 0
2026-05-01 03:40:00.173793 IP 152.53.240.229.5000 > 192.168.19.207.57771: Flags [.], ack 162782, win 2732, options [nop,nop,TS val 3739215022 ecr 2964747284], length 0
2026-05-01 03:40:00.205673 IP 152.53.240.229.5000 > 192.168.19.207.57771: Flags [.], ack 162854, win 2732, options [nop,nop,TS val 3739215055 ecr 2964747316], length 0
2026-05-01 03:40:00.230601 IP 192.168.19.207.57771 > 152.53.240.229.5000: Flags [P.], seq 162854:162946, ack 324632, win 2048, options [nop,nop,TS val 2964747546 ecr 3739215055], length 92
2026-05-01 03:40:00.416920 IP 152.53.240.229.5000 > 192.168.19.207.57771: Flags [P.], seq 324632:324700, ack 162854, win 2732, options [nop,nop,TS val 3739215265 ecr 2964747316], length 68
2026-05-01 03:40:00.417054 IP 192.168.19.207.57771 > 152.53.240.229.5000: Flags [.], ack 324700, win 2047, options [nop,nop,TS val 2964747733 ecr 3739215265], length 0
2026-05-01 03:40:00.417336 IP 192.168.19.207.57771 > 152.53.240.229.5000: Flags [P.], seq 162946:163006, ack 324700, win 2048, options [nop,nop,TS val 2964747733 ecr 3739215265], length 60
2026-05-01 03:40:00.418573 IP 192.168.19.207.57771 > 152.53.240.229.5000: Flags [.], seq 163006:164380, ack 324700, win 2048, options [nop,nop,TS val 2964747734 ecr 3739215265], length 1374
2026-05-01 03:40:00.418604 IP 192.168.19.207.57771 > 152.53.240.229.5000: Flags [P.], seq 164380:164514, ack 324700, win 2048, options [nop,nop,TS val 2964747734 ecr 3739215265], length 134
2026-05-01 03:40:00.418642 IP 192.168.19.207.57771 > 152.53.240.229.5000: Flags [P.], seq 164514:164673, ack 324700, win 2048, options [nop,nop,TS val 2964747734 ecr 3739215265], length 159
2026-05-01 03:40:00.456451 IP 152.53.240.229.5000 > 192.168.19.207.57771: Flags [.], ack 162946, win 2732, options [nop,nop,TS val 3739215306 ecr 2964747546], length 0
2026-05-01 03:40:00.709827 IP 152.53.240.229.5000 > 192.168.19.207.57771: Flags [P.], seq 324700:324792, ack 162946, win 2732, options [nop,nop,TS val 3739215460 ecr 2964747733], length 92
2026-05-01 03:40:00.709829 IP 152.53.240.229.5000 > 192.168.19.207.57771: Flags [.], ack 163006, win 2732, options [nop,nop,TS val 3739215464 ecr 2964747733], length 0
2026-05-01 03:40:00.709831 IP 152.53.240.229.5000 > 192.168.19.207.57771: Flags [.], ack 164380, win 2755, options [nop,nop,TS val 3739215470 ecr 2964747734], length 0
2026-05-01 03:40:00.709832 IP 152.53.240.229.5000 > 192.168.19.207.57771: Flags [.], ack 164514, win 2776, options [nop,nop,TS val 3739215471 ecr 2964747734], length 0
2026-05-01 03:40:00.709833 IP 152.53.240.229.5000 > 192.168.19.207.57771: Flags [.], ack 164673, win 2798, options [nop,nop,TS val 3739215472 ecr 2964747734], length 0
2026-05-01 03:40:00.709977 IP 192.168.19.207.57771 > 152.53.240.229.5000: Flags [.], ack 324792, win 2047, options [nop,nop,TS val 2964748026 ecr 3739215460], length 0
2026-05-01 03:40:00.840753 IP 152.53.240.229.5000 > 192.168.19.207.57771: Flags [.], seq 324792:326166, ack 164673, win 2798, options [nop,nop,TS val 3739215682 ecr 2964747734], length 1374
2026-05-01 03:40:00.840894 IP 192.168.19.207.57771 > 152.53.240.229.5000: Flags [.], ack 326166, win 2027, options [nop,nop,TS val 2964748157 ecr 3739215682], length 0
2026-05-01 03:40:00.912924 IP 152.53.240.229.5000 > 192.168.19.207.57771: Flags [.], seq 326166:327540, ack 164673, win 2798, options [nop,nop,TS val 3739215741 ecr 2964747734], length 1374
2026-05-01 03:40:00.912982 IP 192.168.19.207.57771 > 152.53.240.229.5000: Flags [.], ack 327540, win 2027, options [nop,nop,TS val 2964748229 ecr 3739215741], length 0
2026-05-01 03:40:00.913164 IP 192.168.19.207.57771 > 152.53.240.229.5000: Flags [P.], seq 164673:164733, ack 327540, win 2048, options [nop,nop,TS val 2964748229 ecr 3739215741], length 60
2026-05-01 03:40:01.026959 IP 152.53.240.229.5000 > 192.168.19.207.57771: Flags [.], seq 327540:328914, ack 164673, win 2798, options [nop,nop,TS val 3739215858 ecr 2964748026], length 1374
2026-05-01 03:40:01.027082 IP 192.168.19.207.57771 > 152.53.240.229.5000: Flags [.], ack 328914, win 2027, options [nop,nop,TS val 2964748343 ecr 3739215858], length 0
2026-05-01 03:40:01.027311 IP 192.168.19.207.57771 > 152.53.240.229.5000: Flags [P.], seq 164733:164793, ack 328914, win 2048, options [nop,nop,TS val 2964748343 ecr 3739215858], length 60
2026-05-01 03:40:01.121582 IP 152.53.240.229.5000 > 192.168.19.207.57771: Flags [P.], seq 328914:329340, ack 164673, win 2798, options [nop,nop,TS val 3739215951 ecr 2964748157], length 426
2026-05-01 03:40:01.121653 IP 192.168.19.207.57771 > 152.53.240.229.5000: Flags [.], ack 329340, win 2042, options [nop,nop,TS val 2964748437 ecr 3739215951], length 0
2026-05-01 03:40:01.121836 IP 192.168.19.207.57771 > 152.53.240.229.5000: Flags [P.], seq 164793:164853, ack 329340, win 2048, options [nop,nop,TS val 2964748438 ecr 3739215951], length 60
2026-05-01 03:40:01.121874 IP 192.168.19.207.57771 > 152.53.240.229.5000: Flags [P.], seq 164853:164913, ack 329340, win 2048, options [nop,nop,TS val 2964748438 ecr 3739215951], length 60
2026-05-01 03:40:01.130793 IP 152.53.240.229.5000 > 192.168.19.207.57771: Flags [.], ack 164733, win 2798, options [nop,nop,TS val 3739215981 ecr 2964748229], length 0
2026-05-01 03:40:01.132519 IP 192.168.19.207.57771 > 152.53.240.229.5000: Flags [P.], seq 164913:165053, ack 329340, win 2048, options [nop,nop,TS val 2964748448 ecr 3739215981], length 140
2026-05-01 03:40:01.133769 IP 192.168.19.207.57771 > 152.53.240.229.5000: Flags [P.], seq 165053:165578, ack 329340, win 2048, options [nop,nop,TS val 2964748450 ecr 3739215981], length 525
2026-05-01 03:40:01.133911 IP 192.168.19.207.57771 > 152.53.240.229.5000: Flags [.], seq 165578:166952, ack 329340, win 2048, options [nop,nop,TS val 2964748450 ecr 3739215981], length 1374
2026-05-01 03:40:01.133915 IP 192.168.19.207.57771 > 152.53.240.229.5000: Flags [P.], seq 166952:167086, ack 329340, win 2048, options [nop,nop,TS val 2964748450 ecr 3739215981], length 134
2026-05-01 03:40:01.133939 IP 192.168.19.207.57771 > 152.53.240.229.5000: Flags [.], seq 167086:168460, ack 329340, win 2048, options [nop,nop,TS val 2964748450 ecr 3739215981], length 1374
2026-05-01 03:40:01.133943 IP 192.168.19.207.57771 > 152.53.240.229.5000: Flags [P.], seq 168460:168594, ack 329340, win 2048, options [nop,nop,TS val 2964748450 ecr 3739215981], length 134
2026-05-01 03:40:01.233607 IP 152.53.240.229.5000 > 192.168.19.207.57771: Flags [.], ack 164793, win 2798, options [nop,nop,TS val 3739216083 ecr 2964748343], length 0
2026-05-01 03:40:01.327246 IP 152.53.240.229.5000 > 192.168.19.207.57771: Flags [.], ack 164853, win 2798, options [nop,nop,TS val 3739216176 ecr 2964748438], length 0
2026-05-01 03:40:01.327248 IP 152.53.240.229.5000 > 192.168.19.207.57771: Flags [.], ack 164913, win 2798, options [nop,nop,TS val 3739216176 ecr 2964748438], length 0
2026-05-01 03:40:01.346989 IP 152.53.240.229.5000 > 192.168.19.207.57771: Flags [.], ack 165053, win 2819, options [nop,nop,TS val 3739216197 ecr 2964748448], length 0
2026-05-01 03:40:01.364055 IP 152.53.240.229.5000 > 192.168.19.207.57771: Flags [.], ack 165578, win 2841, options [nop,nop,TS val 3739216214 ecr 2964748450], length 0
2026-05-01 03:40:01.364143 IP 192.168.19.207.57771 > 152.53.240.229.5000: Flags [P.], seq 168594:169411, ack 329340, win 2048, options [nop,nop,TS val 2964748680 ecr 3739216214], length 817
2026-05-01 03:40:01.374810 IP 152.53.240.229.5000 > 192.168.19.207.57771: Flags [.], ack 166952, win 2863, options [nop,nop,TS val 3739216224 ecr 2964748450], length 0
2026-05-01 03:40:01.374812 IP 152.53.240.229.5000 > 192.168.19.207.57771: Flags [.], ack 167086, win 2885, options [nop,nop,TS val 3739216225 ecr 2964748450], length 0
2026-05-01 03:40:01.380209 IP 152.53.240.229.5000 > 192.168.19.207.57771: Flags [.], ack 168594, win 2908, options [nop,nop,TS val 3739216230 ecr 2964748450], length 0
2026-05-01 03:40:01.578622 IP 152.53.240.229.5000 > 192.168.19.207.57771: Flags [P.], seq 329340:329703, ack 168594, win 2908, options [nop,nop,TS val 3739216408 ecr 2964748450], length 363
2026-05-01 03:40:01.578745 IP 192.168.19.207.57771 > 152.53.240.229.5000: Flags [.], ack 329703, win 2043, options [nop,nop,TS val 2964748894 ecr 3739216408], length 0
2026-05-01 03:40:01.578930 IP 192.168.19.207.57771 > 152.53.240.229.5000: Flags [P.], seq 169411:169471, ack 329703, win 2048, options [nop,nop,TS val 2964748895 ecr 3739216408], length 60
2026-05-01 03:40:01.590036 IP 152.53.240.229.5000 > 192.168.19.207.57771: Flags [.], ack 169411, win 2930, options [nop,nop,TS val 3739216440 ecr 2964748680], length 0
2026-05-01 03:40:01.776648 IP 152.53.240.229.5000 > 192.168.19.207.57771: Flags [P.], seq 329703:330278, ack 169411, win 2930, options [nop,nop,TS val 3739216622 ecr 2964748894], length 575
2026-05-01 03:40:01.776773 IP 192.168.19.207.57771 > 152.53.240.229.5000: Flags [.], ack 330278, win 2040, options [nop,nop,TS val 2964749092 ecr 3739216622], length 0
2026-05-01 03:40:01.776995 IP 192.168.19.207.57771 > 152.53.240.229.5000: Flags [P.], seq 169471:169531, ack 330278, win 2048, options [nop,nop,TS val 2964749093 ecr 3739216622], length 60
2026-05-01 03:40:01.791139 IP 152.53.240.229.5000 > 192.168.19.207.57771: Flags [.], ack 169471, win 2930, options [nop,nop,TS val 3739216642 ecr 2964748895], length 0
2026-05-01 03:40:01.973160 IP 192.168.19.207.57771 > 152.53.240.229.5000: Flags [P.], seq 169531:170256, ack 330278, win 2048, options [nop,nop,TS val 2964749289 ecr 3739216642], length 725
2026-05-01 03:40:01.992206 IP 152.53.240.229.5000 > 192.168.19.207.57771: Flags [P.], seq 330278:330849, ack 169471, win 2930, options [nop,nop,TS val 3739216820 ecr 2964749092], length 571
2026-05-01 03:40:01.992286 IP 192.168.19.207.57771 > 152.53.240.229.5000: Flags [.], ack 330849, win 2040, options [nop,nop,TS val 2964749308 ecr 3739216820], length 0
2026-05-01 03:40:01.992436 IP 192.168.19.207.57771 > 152.53.240.229.5000: Flags [P.], seq 170256:170316, ack 330849, win 2048, options [nop,nop,TS val 2964749308 ecr 3739216820], length 60
2026-05-01 03:40:01.995733 IP 152.53.240.229.5000 > 192.168.19.207.57771: Flags [.], ack 169531, win 2930, options [nop,nop,TS val 3739216844 ecr 2964749093], length 0
2026-05-01 03:40:02.177895 IP 152.53.240.229.5000 > 192.168.19.207.57771: Flags [.], ack 170256, win 2951, options [nop,nop,TS val 3739217028 ecr 2964749289], length 0
2026-05-01 03:40:02.187456 IP 152.53.240.229.5000 > 192.168.19.207.57771: Flags [.], ack 170316, win 2951, options [nop,nop,TS val 3739217037 ecr 2964749308], length 0
2026-05-01 03:40:02.399969 IP 152.53.240.229.5000 > 192.168.19.207.57771: Flags [P.], seq 330849:330921, ack 170316, win 2951, options [nop,nop,TS val 3739217238 ecr 2964749308], length 72
2026-05-01 03:40:02.400057 IP 192.168.19.207.57771 > 152.53.240.229.5000: Flags [.], ack 330921, win 2047, options [nop,nop,TS val 2964749716 ecr 3739217238], length 0
2026-05-01 03:40:03.015257 IP 192.168.19.207.57771 > 152.53.240.229.5000: Flags [.], ack 330921, win 2048, length 0
2026-05-01 03:40:03.212064 IP 152.53.240.229.5000 > 192.168.19.207.57771: Flags [.], ack 170316, win 2951, options [nop,nop,TS val 3739218061 ecr 2964749716], length 0
```

Claude reckons the pings are at:

```
03:40:00.230601  192.168.19.207 > 152.53.240.229  length 92   [P.]  ← seq 8 request  (outbound, 92 bytes = 8 VPN overhead + 84
  inner)
  03:40:00.709827  152.53.240.229 > 192.168.19.207  length 92   [P.]  ← seq 8 reply    (inbound,  92 bytes = 8 VPN overhead + 84
  inner)
  03:40:01.364143  192.168.19.207 > 152.53.240.229  length 817  [P.]  ← seq 9 request  (outbound, 92 bytes coalesced within
  817-byte segment)
  03:40:01.776648  152.53.240.229 > 192.168.19.207  length 575  [P.]  ← seq 9 reply    (inbound,  92 bytes coalesced within
  575-byte segment)```

**Comment by jedisct1** [comment]
This capture is excellent, and I think it changes the picture quite a bit.

For seq 8, the timing lines up almost exactly:

* ICMP request appears on `utun6` at `03:40:00.230526`
* encrypted TCP packet leaves on `en0` at `03:40:00.230601`
* encrypted TCP reply arrives on `en0` at `03:40:00.709827`
* ICMP reply appears on `utun6` at `03:40:00.710076`

So the macOS client/utun/userland path is only adding sub-millisecond delay there. The ~480 ms is already present in the outer TCP stream.

The other important bit is that the TCP stream is not only carrying the ping packets. There are multiple larger segments in the same window (`1374`, `817`, `575`, etc.), and as Claude noted, seq 9 is coalesced into a larger TCP segment. That means the ping is sharing the single DSVPN TCP connection with other tunneled traffic. With a TCP-based VPN, that creates classic head-of-line blocking: ICMP has to wait behind whatever else macOS put into the tunnel, even if the direct route to the server is clean and there are no TCP retransmits.

Could you try one more isolation test: build the client without the default routes and route only `1.1.1.1` through the tunnel? That should remove macOS/background traffic from the tunnel and leave almost only the ping.

```sh
make clean
make CFLAGS="-DNO_DEFAULT_ROUTES -O2"
sudo ./dsvpn client vpn.key angry.lastninja.net 5000
```

Then, in another terminal:

```sh
sudo route add -host 1.1.1.1 192.168.192.254
ping -c 20 1.1.1.1
sudo route delete -host 1.1.1.1
```

If that becomes stable around the direct server RTT, then the root cause is likely not a broken `utun` path, but background/default-route traffic causing queueing inside DSVPN's single TCP stream on newer macOS. If it is still bad even with only `1.1.1.1` routed through the tunnel, then we can keep digging into the TCP/server side.

**Comment by nnathan** [comment]
I'm not sure what to make of these results, they're less pronounced, but still also not the ideal RTT of 195-200ms.

```
m:dsvpn $ sudo route add -host 1.1.1.1 192.168.192.254
add host 1.1.1.1: gateway 192.168.192.254

m:dsvpn $ ping -c 20 1.1.1.1
PING 1.1.1.1 (1.1.1.1): 56 data bytes
64 bytes from 1.1.1.1: icmp_seq=0 ttl=57 time=251.174 ms
64 bytes from 1.1.1.1: icmp_seq=1 ttl=57 time=239.677 ms
64 bytes from 1.1.1.1: icmp_seq=2 ttl=57 time=322.769 ms
64 bytes from 1.1.1.1: icmp_seq=3 ttl=57 time=242.023 ms
64 bytes from 1.1.1.1: icmp_seq=4 ttl=57 time=215.074 ms
64 bytes from 1.1.1.1: icmp_seq=5 ttl=57 time=287.064 ms
64 bytes from 1.1.1.1: icmp_seq=6 ttl=57 time=268.719 ms
64 bytes from 1.1.1.1: icmp_seq=7 ttl=57 time=210.806 ms
64 bytes from 1.1.1.1: icmp_seq=8 ttl=57 time=236.699 ms
64 bytes from 1.1.1.1: icmp_seq=9 ttl=57 time=224.550 ms
64 bytes from 1.1.1.1: icmp_seq=10 ttl=57 time=238.725 ms
64 bytes from 1.1.1.1: icmp_seq=11 ttl=57 time=230.380 ms
64 bytes from 1.1.1.1: icmp_seq=12 ttl=57 time=217.530 ms
64 bytes from 1.1.1.1: icmp_seq=13 ttl=57 time=340.370 ms
64 bytes from 1.1.1.1: icmp_seq=14 ttl=57 time=261.937 ms
64 bytes from 1.1.1.1: icmp_seq=15 ttl=57 time=275.305 ms
64 bytes from 1.1.1.1: icmp_seq=16 ttl=57 time=226.364 ms
64 bytes from 1.1.1.1: icmp_seq=17 ttl=57 time=314.100 ms
64 bytes from 1.1.1.1: icmp_seq=18 ttl=57 time=301.228 ms
64 bytes from 1.1.1.1: icmp_seq=19 ttl=57 time=351.962 ms

--- 1.1.1.1 ping statistics ---
20 packets transmitted, 20 packets received, 0.0% packet loss
round-trip min/avg/max/stddev = 210.806/262.823/351.962/42.242 ms

m:dsvpn $ sudo route delete -host 1.1.1.1
delete host 1.1.1.1
```

Did it one more time:

```
m:dsvpn $ sudo route add -host 1.1.1.1 192.168.192.254
add host 1.1.1.1: gateway 192.168.192.254

m:dsvpn $ ping -c 20 1.1.1.1
PING 1.1.1.1 (1.1.1.1): 56 data bytes
64 bytes from 1.1.1.1: icmp_seq=0 ttl=57 time=253.293 ms
64 bytes from 1.1.1.1: icmp_seq=1 ttl=57 time=875.818 ms
64 bytes from 1.1.1.1: icmp_seq=2 ttl=57 time=381.461 ms
64 bytes from 1.1.1.1: icmp_seq=3 ttl=57 time=302.150 ms
64 bytes from 1.1.1.1: icmp_seq=4 ttl=57 time=268.594 ms
64 bytes from 1.1.1.1: icmp_seq=5 ttl=57 time=266.895 ms
64 bytes from 1.1.1.1: icmp_seq=6 ttl=57 time=301.640 ms
64 bytes from 1.1.1.1: icmp_seq=7 ttl=57 time=267.196 ms
64 bytes from 1.1.1.1: icmp_seq=8 ttl=57 time=261.780 ms
64 bytes from 1.1.1.1: icmp_seq=9 ttl=57 time=277.762 ms
64 bytes from 1.1.1.1: icmp_seq=10 ttl=57 time=299.147 ms
64 bytes from 1.1.1.1: icmp_seq=11 ttl=57 time=276.448 ms
64 bytes from 1.1.1.1: icmp_seq=12 ttl=57 time=338.608 ms
64 bytes from 1.1.1.1: icmp_seq=13 ttl=57 time=340.264 ms
64 bytes from 1.1.1.1: icmp_seq=14 ttl=57 time=961.995 ms
64 bytes from 1.1.1.1: icmp_seq=15 ttl=57 time=744.059 ms
64 bytes from 1.1.1.1: icmp_seq=16 ttl=57 time=338.077 ms
64 bytes from 1.1.1.1: icmp_seq=17 ttl=57 time=256.024 ms
Request timeout for icmp_seq 18
64 bytes from 1.1.1.1: icmp_seq=18 ttl=57 time=1455.966 ms
64 bytes from 1.1.1.1: icmp_seq=19 ttl=57 time=986.174 ms

--- 1.1.1.1 ping statistics ---
20 packets transmitted, 20 packets received, 0.0% packet loss
round-trip min/avg/max/stddev = 253.293/472.668/1455.966/331.571 ms

m:dsvpn $ sudo route delete -host 1.1.1.1
delete host 1.1.1.1
```

**Comment by jedisct1** [comment]
Thanks, this is still useful data.

The first isolated run is much less bad than the earlier full-route captures, so default-route/background traffic does look like it was contributing. But the second run means it either is not the whole story, or the isolation was not actually clean.

Could you do two quick sanity checks while running the `NO_DEFAULT_ROUTES` binary?

```sh
netstat -rn -f inet | egrep '(^0/1|^128/1|1\.1\.1\.1)'
route -n get 1.1.1.1
```

With `NO_DEFAULT_ROUTES`, there should be no `0/1` or `128/1` routes through the tunnel, only the explicit host route for `1.1.1.1` via `192.168.192.254`.

Also, while the isolated ping is running, this should stay quiet:

```sh
sudo tcpdump -tttt -n -i utun6 'not (icmp and host 1.1.1.1)'
```

If it prints anything, something else is still entering the tunnel. One common gotcha: if the machine uses `1.1.1.1` as a DNS resolver, that host route will catch DNS traffic too.

One more useful split test would be:

```sh
ping -c 20 192.168.192.254
```

That pings the server-side tunnel address and removes the server -> Internet -> `1.1.1.1` leg from the measurement. If `192.168.192.254` is stable but `1.1.1.1` spikes, the remaining jitter is probably beyond DSVPN. If `192.168.192.254` spikes too, then we should focus on the DSVPN outer TCP path. In that case, another paired `utun6`/`en0` tcpdump during a bad isolated ping would tell us whether the large non-ping TCP segments are gone; if they are gone and the spikes remain, the next diagnostic patch should instrument the outer TCP socket queueing rather than `utun`.

**Comment by nnathan** [comment]
- No default route or host route set:

```
m:dsvpn $ netstat -rn -f inet | egrep '(^0/1|^128/1|1\.1\.1\.1)'
m:dsvpn $ route -n get 1.1.1.1
   route to: 1.1.1.1
destination: default
       mask: default
    gateway: 192.168.1.251
  interface: en0
      flags: <UP,GATEWAY,DONE,STATIC,PRCLONING,GLOBAL>
 recvpipe  sendpipe  ssthresh  rtt,msec    rttvar  hopcount      mtu     expire
       0         0         0         0         0         0      1500         0
```

- after host route set

```
m:dsvpn $ netstat -rn -f inet | egrep '(^0/1|^128/1|1\.1\.1\.1)'
1.1.1.1            192.168.192.254    UGHS                utun6
m:dsvpn $ route -n get 1.1.1.1
   route to: 1.1.1.1
destination: 1.1.1.1
    gateway: 192.168.192.254
  interface: utun6
      flags: <UP,GATEWAY,HOST,DONE,STATIC>
 recvpipe  sendpipe  ssthresh  rtt,msec    rttvar  hopcount      mtu     expire
       0         0         0         0         0         0      9000         0
```

- Ping output:

```
m:dsvpn $ ping -c 20 1.1.1.1
PING 1.1.1.1 (1.1.1.1): 56 data bytes
64 bytes from 1.1.1.1: icmp_seq=0 ttl=57 time=230.108 ms
64 bytes from 1.1.1.1: icmp_seq=1 ttl=57 time=250.273 ms
64 bytes from 1.1.1.1: icmp_seq=2 ttl=57 time=218.616 ms
64 bytes from 1.1.1.1: icmp_seq=3 ttl=57 time=216.930 ms
64 bytes from 1.1.1.1: icmp_seq=4 ttl=57 time=244.195 ms
64 bytes from 1.1.1.1: icmp_seq=5 ttl=57 time=247.508 ms
64 bytes from 1.1.1.1: icmp_seq=6 ttl=57 time=326.766 ms
64 bytes from 1.1.1.1: icmp_seq=7 ttl=57 time=212.844 ms
64 bytes from 1.1.1.1: icmp_seq=8 ttl=57 time=206.453 ms
64 bytes from 1.1.1.1: icmp_seq=9 ttl=57 time=770.405 ms
64 bytes from 1.1.1.1: icmp_seq=10 ttl=57 time=245.880 ms
64 bytes from 1.1.1.1: icmp_seq=11 ttl=57 time=737.043 ms
64 bytes from 1.1.1.1: icmp_seq=12 ttl=57 time=230.913 ms
64 bytes from 1.1.1.1: icmp_seq=13 ttl=57 time=220.732 ms
64 bytes from 1.1.1.1: icmp_seq=14 ttl=57 time=227.358 ms
64 bytes from 1.1.1.1: icmp_seq=15 ttl=57 time=201.176 ms
64 bytes from 1.1.1.1: icmp_seq=16 ttl=57 time=229.137 ms
64 bytes from 1.1.1.1: icmp_seq=17 ttl=57 time=201.854 ms
64 bytes from 1.1.1.1: icmp_seq=18 ttl=57 time=211.303 ms
64 bytes from 1.1.1.1: icmp_seq=19 ttl=57 time=257.210 ms

--- 1.1.1.1 ping statistics ---
20 packets transmitted, 20 packets received, 0.0% packet loss
round-trip min/avg/max/stddev = 201.176/284.335/770.405/158.836 ms
```

- I am not using 1.1.1.1 as my resolver, just whatever the hotel wifi dhcp hands down.

- ~tcpdump output was quiet~ -- I just saw this output: -- (ahh ignore the following, that was me trying to ping tunnel endpoint):

```
sudo tcpdump -tttt -n -i utun6 'not (icmp and host 1.1.1.1)'
tcpdump: verbose output suppressed, use -v[v]... for full protocol decode
listening on utun6, link-type NULL (BSD loopback), snapshot length 524288 bytes
2026-05-01 06:00:49.036408 IP 192.168.192.1 > 192.168.192.254: ICMP echo request, id 22938, seq 0, length 64
2026-05-01 06:00:50.041578 IP 192.168.192.1 > 192.168.192.254: ICMP echo request, id 22938, seq 1, length 64
2026-05-01 06:01:20.412613 IP 192.168.192.1 > 192.168.192.254: ICMP echo request, id 27802, seq 0, length 64
2026-05-01 06:01:21.417784 IP 192.168.192.1 > 192.168.192.254: ICMP echo request, id 27802, seq 1, length 64
```

- `ping -c 20 192.168.192.254` didn't work because the tun endpoint IPs don't respond to ICMP on either client or server side.

**Comment by jedisct1** [comment]
Thanks, that confirms the route side: with the host route installed, only `1.1.1.1` is going through `utun6`, and the quiet `tcpdump` rules out background tunneled traffic for that run. The tunnel endpoint not answering ICMP is fine; that is not a blocker.

I spotted something in the socket setup that is worth testing before adding more instrumentation. `tcp_opts()` currently treats `TCP_QUICKACK` and `TCP_NODELAY` as alternatives. On Linux, `TCP_QUICKACK` is defined, so the server does not set `TCP_NODELAY`. But `TCP_QUICKACK` only changes ACK behavior; it does not disable Nagle/coalescing for the small DSVPN records. That could explain the remaining isolated spikes, especially since the earlier capture showed one ping record being coalesced into a larger TCP segment.

Could you try this patch on the server at least, and on the client too if convenient?

```diff
--- a/src/os.c
+++ b/src/os.c
@@ -344,10 +344,11 @@
     int on = 1;
 
     (void) setsockopt(fd, SOL_SOCKET, SO_KEEPALIVE, (char *) &on, sizeof on);
+#ifdef TCP_NODELAY
+    (void) setsockopt(fd, IPPROTO_TCP, TCP_NODELAY, (char *) &on, sizeof on);
+#endif
 #ifdef TCP_QUICKACK
     (void) setsockopt(fd, IPPROTO_TCP, TCP_QUICKACK, (char *) &on, sizeof on);
-#else
-    (void) setsockopt(fd, IPPROTO_TCP, TCP_NODELAY, (char *) &on, sizeof on);
 #endif
 #ifdef TCP_CONGESTION
     (void) setsockopt(fd, IPPROTO_TCP, TCP_CONGESTION, OUTER_CONGESTION_CONTROL_ALG,
```

Then rebuild/restart the server, rebuild the client the same way as before with `-DNO_DEFAULT_ROUTES`, and repeat the host-route ping to `1.1.1.1`.

If this removes or sharply reduces the 700 ms spikes, we likely found a real bug. If it does not, the next best data is one more paired `utun6`/`en0` tcpdump during an isolated bad ping; with background traffic ruled out, that will tell us whether the delay is already in the outer TCP stream or after it reaches the client.

**Comment by nnathan** [comment]
Patched the server and restarted it, patched the client too and rebuilt it with NO_DEFAULT_ROUTES. Tried my hardest to get the tunnel endpoints pingable but in the end couldn't figure it out (I think I've been able to before with OpenVPN -- but I wonder if the tun interface user has to implement ICMP).

Here is the ping:

```
m:dsvpn $ ping -c 20 1.1.1.1
PING 1.1.1.1 (1.1.1.1): 56 data bytes
64 bytes from 1.1.1.1: icmp_seq=0 ttl=57 time=236.935 ms
64 bytes from 1.1.1.1: icmp_seq=1 ttl=57 time=217.668 ms
64 bytes from 1.1.1.1: icmp_seq=2 ttl=57 time=811.422 ms
64 bytes from 1.1.1.1: icmp_seq=3 ttl=57 time=702.328 ms
64 bytes from 1.1.1.1: icmp_seq=4 ttl=57 time=246.025 ms
64 bytes from 1.1.1.1: icmp_seq=5 ttl=57 time=713.356 ms
64 bytes from 1.1.1.1: icmp_seq=6 ttl=57 time=745.288 ms
64 bytes from 1.1.1.1: icmp_seq=7 ttl=57 time=742.422 ms
64 bytes from 1.1.1.1: icmp_seq=8 ttl=57 time=259.543 ms
64 bytes from 1.1.1.1: icmp_seq=9 ttl=57 time=290.267 ms
64 bytes from 1.1.1.1: icmp_seq=10 ttl=57 time=294.478 ms
64 bytes from 1.1.1.1: icmp_seq=11 ttl=57 time=275.787 ms
64 bytes from 1.1.1.1: icmp_seq=12 ttl=57 time=225.907 ms
Request timeout for icmp_seq 13
64 bytes from 1.1.1.1: icmp_seq=13 ttl=57 time=1256.347 ms
64 bytes from 1.1.1.1: icmp_seq=14 ttl=57 time=832.764 ms
64 bytes from 1.1.1.1: icmp_seq=15 ttl=57 time=195.525 ms
64 bytes from 1.1.1.1: icmp_seq=16 ttl=57 time=221.689 ms
64 bytes from 1.1.1.1: icmp_seq=17 ttl=57 time=255.580 ms
64 bytes from 1.1.1.1: icmp_seq=18 ttl=57 time=232.961 ms
64 bytes from 1.1.1.1: icmp_seq=19 ttl=57 time=637.484 ms

--- 1.1.1.1 ping statistics ---
20 packets transmitted, 20 packets received, 0.0% packet loss
round-trip min/avg/max/stddev = 195.525/469.689/1256.347/297.470 m
```

**Comment by jedisct1** [comment]
Thanks for testing that. So the `TCP_NODELAY`/`TCP_QUICKACK` idea is not the explanation for the big spikes. The endpoint ICMP issue is fine; no need to spend more time on that.

At this point I don't want to guess from ping output alone. Since the route isolation is now confirmed clean, the useful next step is to timestamp one bad isolated ping again and locate exactly where the delay appears.

Could you keep the same `NO_DEFAULT_ROUTES` + host-route setup and run these in two terminals while doing another `ping -c 20 1.1.1.1`?

```sh
sudo tcpdump -tttt -n -l -i utun6 'icmp and host 1.1.1.1' | tee /tmp/dsvpn-utun.txt
```

```sh
sudo tcpdump -tttt -n -l -i en0 'tcp and host angry.lastninja.net and port 5000' | tee /tmp/dsvpn-en0.txt
```

If the outer interface is not `en0`, use the Wi-Fi interface from `route -n get angry.lastninja.net`.

Then paste the lines from both files around one of the high-latency sequences, ideally from ~2 seconds before to ~2 seconds after the spike.

What this should tell us:

* if the ICMP request appears on `utun6` and the encrypted TCP packet leaves `en0` immediately, the client read/encrypt path is fine;
* if the encrypted TCP reply arrives on `en0` late, the delay is in the outer TCP/server/remote-Internet side;
* if the encrypted TCP reply arrives on `en0` quickly but the ICMP reply appears on `utun6` late, then we should instrument the client event loop again.

One optional sanity check, if it is easy: run `ping -c 20 angry.lastninja.net` outside the tunnel immediately before or after the test. If that also has similar bursts from the hotel network, that would explain a lot.

**Comment by nnathan** [comment]
- Before ping 1.1.1.1:

```
--- angry.lastninja.net ping statistics ---
20 packets transmitted, 20 packets received, 0.0% packet loss
round-trip min/avg/max/stddev = 191.178/193.308/208.024/3.750 ms
```

- Ping 1.1.1.1

Ping:

```
64 bytes from 1.1.1.1: icmp_seq=16 ttl=57 time=265.432 ms
64 bytes from 1.1.1.1: icmp_seq=17 ttl=57 time=903.485 ms
Request timeout for icmp_seq 18
64 bytes from 1.1.1.1: icmp_seq=18 ttl=57 time=1736.276 ms
64 bytes from 1.1.1.1: icmp_seq=19 ttl=57 time=736.112 ms
```

Tun dump:

```
2026-05-01 06:44:02.382609 IP 192.168.192.1 > 1.1.1.1: ICMP echo request, id 39325, seq 12, length 64
2026-05-01 06:44:02.633231 IP 1.1.1.1 > 192.168.192.1: ICMP echo reply, id 39325, seq 12, length 64
2026-05-01 06:44:03.387392 IP 192.168.192.1 > 1.1.1.1: ICMP echo request, id 39325, seq 13, length 64
2026-05-01 06:44:03.706221 IP 1.1.1.1 > 192.168.192.1: ICMP echo reply, id 39325, seq 13, length 64
2026-05-01 06:44:04.387867 IP 192.168.192.1 > 1.1.1.1: ICMP echo request, id 39325, seq 14, length 64
2026-05-01 06:44:04.638551 IP 1.1.1.1 > 192.168.192.1: ICMP echo reply, id 39325, seq 14, length 64
2026-05-01 06:44:05.392996 IP 192.168.192.1 > 1.1.1.1: ICMP echo request, id 39325, seq 15, length 64
2026-05-01 06:44:05.604531 IP 1.1.1.1 > 192.168.192.1: ICMP echo reply, id 39325, seq 15, length 64
2026-05-01 06:44:06.398119 IP 192.168.192.1 > 1.1.1.1: ICMP echo request, id 39325, seq 16, length 64
2026-05-01 06:44:06.663384 IP 1.1.1.1 > 192.168.192.1: ICMP echo reply, id 39325, seq 16, length 64
2026-05-01 06:44:07.400553 IP 192.168.192.1 > 1.1.1.1: ICMP echo request, id 39325, seq 17, length 64
2026-05-01 06:44:08.303852 IP 1.1.1.1 > 192.168.192.1: ICMP echo reply, id 39325, seq 17, length 64
2026-05-01 06:44:08.404489 IP 192.168.192.1 > 1.1.1.1: ICMP echo request, id 39325, seq 18, length 64
2026-05-01 06:44:09.404662 IP 192.168.192.1 > 1.1.1.1: ICMP echo request, id 39325, seq 19, length 64
2026-05-01 06:44:10.140551 IP 1.1.1.1 > 192.168.192.1: ICMP echo reply, id 39325, seq 18, length 64
2026-05-01 06:44:10.140560 IP 1.1.1.1 > 192.168.192.1: ICMP echo reply, id 39325, seq 19, length 64
```

Outer TCP dump:

```
2026-05-01 06:44:07.400632 IP 192.168.19.207.59052 > 152.53.240.229.5000: Flags [P.], seq 1564:1656, ack 1565, win 2048, options [nop,nop,TS val 79730610 ecr 3750261760], length 92
2026-05-01 06:44:08.045811 IP 192.168.19.207.59052 > 152.53.240.229.5000: Flags [P.], seq 1564:1656, ack 1565, win 2048, options [nop,nop,TS val 79731255 ecr 3750261760], length 92
2026-05-01 06:44:08.293022 IP 152.53.240.229.5000 > 192.168.19.207.59052: Flags [.], ack 1656, win 508, options [nop,nop,TS val 3750263214 ecr 79731255], length 0
2026-05-01 06:44:08.303613 IP 152.53.240.229.5000 > 192.168.19.207.59052: Flags [P.], seq 1565:1657, ack 1656, win 508, options [nop,nop,TS val 3750263216 ecr 79731255], length 92
2026-05-01 06:44:08.303707 IP 192.168.19.207.59052 > 152.53.240.229.5000: Flags [.], ack 1657, win 2047, options [nop,nop,TS val 79731513 ecr 3750263216], length 0
2026-05-01 06:44:08.404620 IP 192.168.19.207.59052 > 152.53.240.229.5000: Flags [P.], seq 1656:1748, ack 1657, win 2048, options [nop,nop,TS val 79731614 ecr 3750263216], length 92
2026-05-01 06:44:09.043987 IP 192.168.19.207.59052 > 152.53.240.229.5000: Flags [P.], seq 1656:1748, ack 1657, win 2048, options [nop,nop,TS val 79732253 ecr 3750263216], length 92
2026-05-01 06:44:09.183296 IP 192.168.19.207.59052 > 152.53.240.229.5000: Flags [.], ack 1657, win 2048, length 0
2026-05-01 06:44:09.284377 IP 152.53.240.229.5000 > 192.168.19.207.59052: Flags [.], ack 1748, win 508, options [nop,nop,TS val 3750264203 ecr 79732253], length 0
2026-05-01 06:44:09.376988 IP 152.53.240.229.5000 > 192.168.19.207.59052: Flags [.], ack 1748, win 508, options [nop,nop,TS val 3750264299 ecr 79732253], length 0
2026-05-01 06:44:09.404785 IP 192.168.19.207.59052 > 152.53.240.229.5000: Flags [P.], seq 1748:1840, ack 1657, win 2048, options [nop,nop,TS val 79732614 ecr 3750264203], length 92
2026-05-01 06:44:09.611149 IP 152.53.240.229.5000 > 192.168.19.207.59052: Flags [P.], seq 1749:1841, ack 1840, win 508, options [nop,nop,TS val 3750264533 ecr 79732614], length 92
2026-05-01 06:44:09.611287 IP 192.168.19.207.59052 > 152.53.240.229.5000: Flags [.], ack 1657, win 2048, options [nop,nop,TS val 79732820 ecr 3750264203,nop,nop,sack 1 {1749:1841}], length 0
2026-05-01 06:44:09.720974 IP 152.53.240.229.5000 > 192.168.19.207.59052: Flags [P.], seq 1749:1841, ack 1840, win 508, options [nop,nop,TS val 3750264630 ecr 79732614], length 92
2026-05-01 06:44:09.721117 IP 192.168.19.207.59052 > 152.53.240.229.5000: Flags [.], ack 1657, win 2048, options [nop,nop,TS val 79732930 ecr 3750264203,nop,nop,sack 2 {1749:1841}{1749:1841}], length 0
2026-05-01 06:44:10.140314 IP 152.53.240.229.5000 > 192.168.19.207.59052: Flags [P.], seq 1657:1749, ack 1840, win 508, options [nop,nop,TS val 3750265053 ecr 79732930], length 92
2026-05-01 06:44:10.140469 IP 192.168.19.207.59052 > 152.53.240.229.5000: Flags [.], ack 1841, win 2046, options [nop,nop,TS val 79733350 ecr 3750265053], length 0
2026-05-01 06:44:11.059510 IP 192.168.19.207.59052 > 152.53.240.229.5000: Flags [.], ack 1841, win 2048, length 0
2026-05-01 06:44:11.263988 IP 152.53.240.229.5000 > 192.168.19.207.59052: Flags [.], ack 1840, win 508, options [nop,nop,TS val 3750266176 ecr 79733350], length 0
```

Claude analysis:

```
⏺ ICMP seq 17 — time=903.485 ms

  ICMP dump:
  06:44:07.400553  request sent
  06:44:08.303852  reply received  (Δ = 903.3 ms ✓)

  TCP/VPN tunnel dump:
  06:44:07.400632  [P.] client → server  seq 1564:1656  (ICMP req encapsulated, sent)
  06:44:08.045811  [P.] client → server  seq 1564:1656  (retransmit — no ACK yet after ~645ms)
  06:44:08.293022  [.]  server → client  ack 1656        (server finally ACKs the data)
  06:44:08.303613  [P.] server → client  seq 1565:1657   (ICMP reply encapsulated, delivered)
  06:44:08.303707  [.]  client → server  ack 1657        (client ACKs reply)
  The VPN had to retransmit the encapsulated packet once before the server responded, adding ~645ms of extra delay on top of
  baseline.

  ---
  ICMP seq 18 — timeout then time=1736.276 ms

  ICMP dump:
  06:44:08.404489  request sent
  (no reply within 1s → "Request timeout" printed by ping)
  06:44:10.140551  reply received  (Δ = 1736.1 ms ✓)

  TCP/VPN tunnel dump:
  06:44:08.404620  [P.] client → server  seq 1656:1748  (ICMP req encapsulated, sent)
  06:44:09.043987  [P.] client → server  seq 1656:1748  (retransmit #1 after ~639ms)
  06:44:09.183296  [.]  client → server  ack 1657        (bare ACK — keepalive/ack flush)
  06:44:09.284377  [.]  server → client  ack 1748        (server finally ACKs data)
  06:44:09.376988  [.]  server → client  ack 1748        (duplicate ACK from server)
    ... server sends seq 19's reply first (see below) ...
  06:44:10.140314  [P.] server → client  seq 1657:1749   (ICMP reply for seq 18, delivered last)
  06:44:10.140469  [.]  client → server  ack 1841        (client ACKs everything in one shot)
  The server ACKed the request at 09.284 but sent seq 19's reply first (out of TCP order), leaving seq 18's reply blocked until
  10.140.

  ---
  ICMP seq 19 — time=736.112 ms

  ICMP dump:
  06:44:09.404662  request sent
  06:44:10.140560  reply received  (Δ = 736.0 ms ✓)

  TCP/VPN tunnel dump:
  06:44:09.404785  [P.] client → server  seq 1748:1840  (ICMP req encapsulated, sent)
  06:44:09.611149  [P.] server → client  seq 1749:1841  (ICMP reply arrived at server fast — only ~206ms)
  06:44:09.611287  [.]  client → server  SACK {1749:1841} (client got it but seq 1657:1749 still missing)
  06:44:09.720974  [P.] server → client  seq 1749:1841  (server retransmits, thinking it was lost)
  06:44:09.721117  [.]  client → server  SACK {1749:1841}{1749:1841} (still holding — gap not filled)
  06:44:10.140314  [P.] server → client  seq 1657:1749  (gap filled: seq 18's reply finally arrives)
  06:44:10.140469  [.]  client → server  ack 1841        (TCP delivers both 18+19 to app simultaneously)
```

- After ping 1.1.1.1:

```
--- angry.lastninja.net ping statistics ---
20 packets transmitted, 20 packets received, 0.0% packet loss
round-trip min/avg/max/stddev = 191.021/195.265/217.217/7.471 ms
```

**Comment by jedisct1** [comment]
Thanks, this capture is very helpful. I think this is now pretty conclusive.

The client-side DSVPN path itself is not where the large delay is introduced:

* `utun6` -> outer TCP is immediate. For example seq 17 appears on `utun6` at `06:44:07.400553` and the encrypted TCP packet leaves at `06:44:07.400632`, so that path is only ~0.08 ms.
* The delay is already visible in the outer TCP stream. For seq 17 and 18, the client retransmits the same encrypted TCP segment after ~640 ms because the ACK for the original segment did not come back in time.
* For seq 19, the reply TCP segment reaches the client at `06:44:09.611149`, but it is beyond a missing earlier TCP segment (`seq 1657:1749`). The client kernel SACKs it, but TCP cannot deliver it to DSVPN until the gap is filled at `06:44:10.140314`. Then the ICMP replies for 18 and 19 appear on `utun6` together.

So the spike is TCP head-of-line blocking on the outer DSVPN connection: one lost/delayed/reordered TCP segment stalls later tunnel packets, even if those later packets already arrived. That matches the classic TCP-over-TCP failure mode, and it also explains why the DSVPN process/event loop instrumentation didn't show local write stalls.

The direct `ping angry.lastninja.net` being stable is still useful, but it only proves that ICMP to the server host is stable. The VPN's long-lived TCP flow on port 5000 is seeing loss/retransmission/reordering in the capture.

I don't think another client-side code patch will fix this class of spike. Practical things worth trying are:

* run the same DSVPN setup on TCP/443, TCP/80, or another port in case this network treats port 5000 differently;
* if you need good latency over lossy/high-RTT links, use a UDP-based VPN instead, because packet loss won't create TCP stream head-of-line blocking;
* if we want to keep improving DSVPN, the `TCP_NODELAY` change is still a reasonable cleanup, but it is not the root cause of these large spikes.

A simultaneous server-side tcpdump could tell which direction the missing segments are lost/delayed in, but I don't think it is necessary to diagnose this as a DSVPN client loop issue anymore.

**Comment by jedisct1** [comment]
One concrete UDP-based alternative to try is Twice:

https://github.com/dip-proto/twice

It should avoid the TCP-over-TCP head-of-line blocking pattern shown in the capture, since packet loss in the outer transport won't stall all later tunnel packets behind one missing TCP segment.

**Comment by nnathan** [comment]
Hi Frank,

While I agree with you on these points. The Linux VM tells a different story. I think it is a very similar setting to `-DNO_DEFAULT_ROUTES` because there is virtually no other traffic being generated to the Internet aside from ICMP to 1.1.1.1.

However in Linux, the latency is near the baseline of angry.lastninja.net and traverses the same hotel network which means 5000/tcp doesn't seem to be molested by the hotel wifi.

This is the ping from my VM:

```
v:dsvpn # ping -c 20 1.1.1.1
PING 1.1.1.1 (1.1.1.1) 56(84) bytes of data.
64 bytes from 1.1.1.1: icmp_seq=1 ttl=57 time=211 ms
64 bytes from 1.1.1.1: icmp_seq=2 ttl=57 time=209 ms
64 bytes from 1.1.1.1: icmp_seq=3 ttl=57 time=228 ms
64 bytes from 1.1.1.1: icmp_seq=4 ttl=57 time=208 ms
64 bytes from 1.1.1.1: icmp_seq=5 ttl=57 time=208 ms
64 bytes from 1.1.1.1: icmp_seq=6 ttl=57 time=210 ms
64 bytes from 1.1.1.1: icmp_seq=7 ttl=57 time=209 ms
64 bytes from 1.1.1.1: icmp_seq=8 ttl=57 time=208 ms
64 bytes from 1.1.1.1: icmp_seq=9 ttl=57 time=209 ms
64 bytes from 1.1.1.1: icmp_seq=10 ttl=57 time=274 ms
64 bytes from 1.1.1.1: icmp_seq=11 ttl=57 time=209 ms
64 bytes from 1.1.1.1: icmp_seq=12 ttl=57 time=210 ms
64 bytes from 1.1.1.1: icmp_seq=13 ttl=57 time=213 ms
64 bytes from 1.1.1.1: icmp_seq=14 ttl=57 time=209 ms
64 bytes from 1.1.1.1: icmp_seq=15 ttl=57 time=208 ms
64 bytes from 1.1.1.1: icmp_seq=16 ttl=57 time=216 ms
64 bytes from 1.1.1.1: icmp_seq=17 ttl=57 time=208 ms
64 bytes from 1.1.1.1: icmp_seq=18 ttl=57 time=239 ms
64 bytes from 1.1.1.1: icmp_seq=19 ttl=57 time=208 ms
64 bytes from 1.1.1.1: icmp_seq=20 ttl=57 time=209 ms

--- 1.1.1.1 ping statistics ---
20 packets transmitted, 20 received, 0% packet loss, time 19053ms
rtt min/avg/max/mdev = 207.655/215.139/274.104/15.532 ms
```

and

```
v:dsvpn # ping -c 20 angry.lastninja.net
PING angry.lastninja.net (152.53.240.229) 56(84) bytes of data.
64 bytes from v2202512327516422119.quicksrv.de (152.53.240.229): icmp_seq=1 ttl=64 time=207 ms
64 bytes from v2202512327516422119.quicksrv.de (152.53.240.229): icmp_seq=2 ttl=64 time=206 ms
64 bytes from v2202512327516422119.quicksrv.de (152.53.240.229): icmp_seq=3 ttl=64 time=241 ms
64 bytes from v2202512327516422119.quicksrv.de (152.53.240.229): icmp_seq=4 ttl=64 time=216 ms
64 bytes from v2202512327516422119.quicksrv.de (152.53.240.229): icmp_seq=5 ttl=64 time=207 ms
64 bytes from v2202512327516422119.quicksrv.de (152.53.240.229): icmp_seq=6 ttl=64 time=207 ms
64 bytes from v2202512327516422119.quicksrv.de (152.53.240.229): icmp_seq=7 ttl=64 time=226 ms
64 bytes from v2202512327516422119.quicksrv.de (152.53.240.229): icmp_seq=8 ttl=64 time=211 ms
64 bytes from v2202512327516422119.quicksrv.de (152.53.240.229): icmp_seq=9 ttl=64 time=211 ms
64 bytes from v2202512327516422119.quicksrv.de (152.53.240.229): icmp_seq=10 ttl=64 time=209 ms
64 bytes from v2202512327516422119.quicksrv.de (152.53.240.229): icmp_seq=11 ttl=64 time=211 ms
64 bytes from v2202512327516422119.quicksrv.de (152.53.240.229): icmp_seq=12 ttl=64 time=208 ms
64 bytes from v2202512327516422119.quicksrv.de (152.53.240.229): icmp_seq=13 ttl=64 time=206 ms
64 bytes from v2202512327516422119.quicksrv.de (152.53.240.229): icmp_seq=14 ttl=64 time=207 ms
64 bytes from v2202512327516422119.quicksrv.de (152.53.240.229): icmp_seq=15 ttl=64 time=208 ms
64 bytes from v2202512327516422119.quicksrv.de (152.53.240.229): icmp_seq=16 ttl=64 time=207 ms
64 bytes from v2202512327516422119.quicksrv.de (152.53.240.229): icmp_seq=17 ttl=64 time=207 ms
64 bytes from v2202512327516422119.quicksrv.de (152.53.240.229): icmp_seq=18 ttl=64 time=206 ms
64 bytes from v2202512327516422119.quicksrv.de (152.53.240.229): icmp_seq=19 ttl=64 time=206 ms
64 bytes from v2202512327516422119.quicksrv.de (152.53.240.229): icmp_seq=20 ttl=64 time=211 ms

--- angry.lastninja.net ping statistics ---
20 packets transmitted, 20 received, 0% packet loss, time 19048ms
rtt min/avg/max/mdev = 205.726/210.897/241.054/8.306 ms
```

(strange thing is that the baseline angry.lastninja.net ping is in 205+ms whereas on the mac host it is 191ms, but only when dsvpn is connected, otherwise the linux baseline is 191ms too)

**Comment by jedisct1** [comment]
Thanks, this is a useful counterpoint.

I agree that the Linux VM result makes the "hotel network or TCP/5000 is always bad" explanation less likely. But I don't think it contradicts the macOS capture: in that bad macOS run, DSVPN handed the packet to the outer TCP socket immediately, and the visible stall was in the outer TCP stream itself: retransmission after ~640 ms, SACK for an out-of-order later segment, then delivery to DSVPN only after the missing TCP segment arrived.

So the difference is probably not `NO_DEFAULT_ROUTES` vs other traffic anymore. It is more likely one of:

* macOS TCP stack / Wi-Fi driver behavior for this long-lived TCP flow;
* VM networking changing the path slightly, especially if it is NATed through the hypervisor;
* some socket option / buffer / packetization difference between the macOS and Linux builds.

The Linux VM is close to the same test, but it is not quite the same as the macOS host test because it uses the Linux TCP stack for the DSVPN connection.

If you still have the setup handy, the most useful comparison would be the same outer TCP capture on the Linux VM during the good ping:

```sh
sudo tcpdump -tttt -n -i <vm-interface> 'tcp and host angry.lastninja.net and port 5000'
```

If the Linux VM has no retransmits/SACK gaps while the macOS host does, that would narrow this down pretty strongly to the client-side OS/network stack around the outer TCP connection rather than DSVPN's tun/event-loop code. Also, is the VM using NAT or bridged networking?

The Twice/UDP suggestion still stands as the practical workaround for this class of head-of-line blocking, but this Linux/macOS difference is definitely interesting if we want to keep narrowing the DSVPN-specific angle.

**Comment by nnathan** [comment]
Testing with timestamps on Linux VM. Hypervisor in NAT mode.

- Ping:

```
v:dsvpn # ping -c 10 angry.lastninja.net
PING angry.lastninja.net (152.53.240.229) 56(84) bytes of data.
64 bytes from v2202512327516422119.quicksrv.de (152.53.240.229): icmp_seq=1 ttl=64 time=225 ms
64 bytes from v2202512327516422119.quicksrv.de (152.53.240.229): icmp_seq=2 ttl=64 time=240 ms
64 bytes from v2202512327516422119.quicksrv.de (152.53.240.229): icmp_seq=3 ttl=64 time=236 ms
64 bytes from v2202512327516422119.quicksrv.de (152.53.240.229): icmp_seq=4 ttl=64 time=249 ms
64 bytes from v2202512327516422119.quicksrv.de (152.53.240.229): icmp_seq=5 ttl=64 time=219 ms
64 bytes from v2202512327516422119.quicksrv.de (152.53.240.229): icmp_seq=6 ttl=64 time=219 ms
64 bytes from v2202512327516422119.quicksrv.de (152.53.240.229): icmp_seq=7 ttl=64 time=215 ms
64 bytes from v2202512327516422119.quicksrv.de (152.53.240.229): icmp_seq=8 ttl=64 time=215 ms
64 bytes from v2202512327516422119.quicksrv.de (152.53.240.229): icmp_seq=9 ttl=64 time=225 ms
64 bytes from v2202512327516422119.quicksrv.de (152.53.240.229): icmp_seq=10 ttl=64 time=214 ms

--- angry.lastninja.net ping statistics ---
10 packets transmitted, 10 received, 0% packet loss, time 8997ms
rtt min/avg/max/mdev = 214.010/225.700/249.106/11.547 ms
```

- Outer tcp (excerpt):

```
2026-05-01 08:59:18.387460 IP 192.168.64.3.53146 > 152.53.240.229.5000: Flags [.], ack 425, win 674, options [nop,nop,TS val 2166192172 ecr 3758860385], length 0
2026-05-01 08:59:19.222140 IP 192.168.64.3.53146 > 152.53.240.229.5000: Flags [P.], seq 424:516, ack 425, win 674, options [nop,nop,TS val 2166193007 ecr 3758860385], length 92
2026-05-01 08:59:19.439982 IP 152.53.240.229.5000 > 192.168.64.3.53146: Flags [P.], seq 425:517, ack 516, win 448, options [nop,nop,TS val 3758861380 ecr 2166193007], length 92
2026-05-01 08:59:19.440089 IP 192.168.64.3.53146 > 152.53.240.229.5000: Flags [.], ack 517, win 674, options [nop,nop,TS val 2166193225 ecr 3758861380], length 0
2026-05-01 08:59:20.305005 IP 192.168.64.3.53146 > 152.53.240.229.5000: Flags [P.], seq 516:608, ack 517, win 674, options [nop,nop,TS val 2166194090 ecr 3758861380], length 92
2026-05-01 08:59:20.523316 IP 152.53.240.229.5000 > 192.168.64.3.53146: Flags [P.], seq 517:609, ack 608, win 448, options [nop,nop,TS val 3758862380 ecr 2166194090], length 92
2026-05-01 08:59:20.523477 IP 192.168.64.3.53146 > 152.53.240.229.5000: Flags [.], ack 609, win 674, options [nop,nop,TS val 2166194308 ecr 3758862380], length 0
2026-05-01 08:59:21.387195 IP 192.168.64.3.53146 > 152.53.240.229.5000: Flags [P.], seq 608:700, ack 609, win 674, options [nop,nop,TS val 2166195172 ecr 3758862380], length 92
2026-05-01 08:59:21.601950 IP 152.53.240.229.5000 > 192.168.64.3.53146: Flags [P.], seq 609:701, ack 700, win 448, options [nop,nop,TS val 3758863375 ecr 2166195172], length 92
2026-05-01 08:59:21.602056 IP 192.168.64.3.53146 > 152.53.240.229.5000: Flags [.], ack 701, win 674, options [nop,nop,TS val 2166195387 ecr 3758863375], length 0
2026-05-01 08:59:22.470607 IP 192.168.64.3.53146 > 152.53.240.229.5000: Flags [P.], seq 700:792, ack 701, win 674, options [nop,nop,TS val 2166196256 ecr 3758863375], length 92
2026-05-01 08:59:22.684505 IP 152.53.240.229.5000 > 192.168.64.3.53146: Flags [P.], seq 701:793, ack 792, win 448, options [nop,nop,TS val 3758864375 ecr 2166196256], length 92
2026-05-01 08:59:22.684610 IP 192.168.64.3.53146 > 152.53.240.229.5000: Flags [.], ack 793, win 674, options [nop,nop,TS val 2166196470 ecr 3758864375], length 0
2026-05-01 08:59:23.554142 IP 192.168.64.3.53146 > 152.53.240.229.5000: Flags [P.], seq 792:884, ack 793, win 674, options [nop,nop,TS val 2166197339 ecr 3758864375], length 92
2026-05-01 08:59:23.778073 IP 152.53.240.229.5000 > 192.168.64.3.53146: Flags [P.], seq 793:885, ack 884, win 448, options [nop,nop,TS val 3758865379 ecr 2166197339], length 92
2026-05-01 08:59:23.778197 IP 192.168.64.3.53146 > 152.53.240.229.5000: Flags [.], ack 885, win 674, options [nop,nop,TS val 2166197563 ecr 3758865379], length 0
2026-05-01 08:59:24.636397 IP 192.168.64.3.53146 > 152.53.240.229.5000: Flags [P.], seq 884:976, ack 885, win 674, options [nop,nop,TS val 2166198421 ecr 3758865379], length 92
2026-05-01 08:59:24.849698 IP 152.53.240.229.5000 > 192.168.64.3.53146: Flags [P.], seq 885:977, ack 976, win 448, options [nop,nop,TS val 3758866374 ecr 2166198421], length 92
2026-05-01 08:59:24.849813 IP 192.168.64.3.53146 > 152.53.240.229.5000: Flags [.], ack 977, win 674, options [nop,nop,TS val 2166198635 ecr 3758866374], length 0
```

- Claude analysis:

```
icmp_seq=8 — ping RTT: 215 ms

  08:59:22.470607  192.168.64.3:53146 → 152.53.240.229:5000  [P.]  seq 700:792  ack 793  len 92
    └─ ICMP echo request encapsulated; client pushes 92 bytes to server
       TS val 2166196256, ecr 3758863375 (echoes server's last timestamp)

  08:59:22.684505  152.53.240.229:5000 → 192.168.64.3:53146  [P.]  seq 701:793  ack 792  len 92
    └─ Server returns encapsulated ICMP echo reply; ACKs client data up to 792
       TS val 3758864375 (server clock), ecr 2166196256 (mirrors client's TS)

  08:59:22.684610  192.168.64.3:53146 → 152.53.240.229:5000  [.]   ack 793  len 0
    └─ Pure ACK; client acknowledges server's response (701:793 received)

  TCP RTT: 684505 − 470607 = 213.9 ms (ping reports 215 ms, δ = 1.1 ms)

  ---
  icmp_seq=9 — ping RTT: 225 ms

  08:59:23.554142  192.168.64.3:53146 → 152.53.240.229:5000  [P.]  seq 792:884  ack 793  len 92
    └─ ICMP echo request; ack 793 confirms prior server push was received
       TS val 2166197339, ecr 3758863375

  08:59:23.778073  152.53.240.229:5000 → 192.168.64.3:53146  [P.]  seq 793:885  ack 884  len 92
    └─ Server echo reply; ACKs client data up to 884
       TS val 3758865379, ecr 2166197339

  08:59:23.778197  192.168.64.3:53146 → 152.53.240.229:5000  [.]   ack 885  len 0
    └─ Pure ACK; client confirms server's 793:885 segment received

  TCP RTT: 778073 − 554142 = 223.9 ms (ping reports 225 ms, δ = 1.1 ms)

  This sequence has the highest RTT of the three — a ~10 ms spike vs. the baseline ~214 ms, visible in both the ping output and
  the TCP timing. Likely momentary congestion or scheduling jitter on the server or path.

  ---
  icmp_seq=10 — ping RTT: 214 ms

  08:59:24.636397  192.168.64.3:53146 → 152.53.240.229:5000  [P.]  seq 884:976  ack 885  len 92
    └─ Final ICMP echo request; ack 885 confirms seq=9 reply received
       TS val 2166198421, ecr 3758865379

  08:59:24.849698  152.53.240.229:5000 → 192.168.64.3:53146  [P.]  seq 885:977  ack 976  len 92
    └─ Server echo reply; ACKs client data up to 976
       TS val 3758866374, ecr 2166198421

  08:59:24.849813  192.168.64.3:53146 → 152.53.240.229:5000  [.]   ack 977  len 0
    └─ Pure ACK; client closes the exchange for this ping

  TCP RTT: 849698 − 636397 = 213.3 ms (ping reports 214 ms, δ = 0.7 ms)
```

Edit: twice looks nice and is something I wanted to build for awhile too in the same spirit as dsvpn so I will definitely check it out.

**Comment by jedisct1** [comment]
Great, thanks. This is exactly the comparison that was missing.

The Linux VM capture has the "healthy" shape: each 92-byte client push is followed by the 92-byte server push about one baseline RTT later, the ping RTT and TCP timing differ by only ~1 ms, and there are no retransmits, SACK gaps, or out-of-order delivery in the excerpt.

That makes the contrast with the macOS capture pretty sharp:

* on macOS, the bad sequence showed a client-side TCP retransmit after ~640 ms and later a SACKed server segment being held behind a missing earlier TCP segment;
* on the Linux VM, over the same hotel network and same server TCP port, the outer TCP stream stays ordered and near baseline.

So I agree with your conclusion that TCP/5000 is not generally being molested by the hotel Wi-Fi. I would narrow the remaining difference to the macOS host's outer TCP path: macOS TCP stack + Wi-Fi driver/hardware/power-management/packetization, possibly interacting with this network. Since the VM is in NAT mode, it still uses the Linux TCP stack for the DSVPN connection; the host is forwarding/NATing those packets, not making the same macOS TCP connection that the native DSVPN client makes.

From the DSVPN side, I don't see an application-level change that can reliably fix this class of stall once the outer TCP stream itself has a missing segment. The `TCP_NODELAY` cleanup is still fine, but it won't prevent TCP head-of-line blocking.

If you want one last narrowing step, I would try either:

* Linux VM in bridged mode, if available. If it is still clean, NAT is not the reason the VM behaves better.
* macOS host over a different link, e.g. phone tethering, Ethernet, or another Wi-Fi. If the spikes disappear there, it points to a macOS Wi-Fi/network interaction rather than DSVPN's tun loop.

And glad Twice looks interesting :) For latency-sensitive traffic over links that occasionally lose/reorder packets, a UDP outer transport is the practical way to avoid this specific head-of-line blocking behavior.
